id,review_text,cleaned_text
0,"Ярко чувствуется мох, бергамот и ананас. Свежий и шлейфовый аромат. Мне кажется, что подойдет для любого времени года и суток.",ярко чувствоваться мох бергамот ананас свежий шлейфовый аромат подойти время год суток
1,Любимый аромат хоть и дорогой но она стоит того запал просто бомба нравиться не то слово на повседневного ношения звучит дорого Всем советую,любимый аромат дорогой стоить запасть бомба нравиться слово повседневный ношение звучать дорого советую
2,"Это такой парфюм, который сразу заявляет о себе. Он свежий, но при этом очень мужественный и дорогой. Он не кричащий, но точно привлекает внимание. Идеален для тех, кто хочет чувствовать себя уверенно и производить впечатление.",парфюм заявлять свежий мужественный дорогой кричать привлекать внимание идеален хотеть чувствовать уверенно производить впечатление
3,"Это тот самый король с дымными приятными ананасами, первое время его хочет ощущать снова и снова однозначно 5 звезд",король дымный приятный ананасами первый время хотеть ощущать однозначно 5 звезда
4,"Красивый статусный аромат. Классика , мужу зашёл, подойдёт и летом и зимой. Можно брать смело, думаю понравится многим.",красивый статусный аромат классик муж зашёл подойдёт лето зима брать смело думать понравиться многим
5,"Спасибо огромное, пришло быстро и хорошо упаковано! Оригинал рекомендую к покупке! Буду заказывать, ещё уже накидала в корзину)) 👍🔥",спасибо огромный прийти быстро упаковать оригинал рекомендовать покупка заказывать накидала корзина 👍 🔥
6,"Aventus - наконец-то потестил легенду! 🔥 Старт сочный: ананас, бергамот, чуть дыма. Потом уходит в благородную древесину с мускусным шлейфом. Не банальный ""свежак"", а аромат с характером - уверенный, но не душит. Стойкость на высоте: 6-7 часов на коже, на одежде до вечера. Шлейф ловят - пару раз спрашивали. Для знакомства с нишей - идеально. Полный флакон пока дороговат, но отлив точно стоит своих денег. Советую!",aventus потестил легенда 🔥 старт сочный ананас бергамот дым уходить благородный древесина мускусный шлейф банальный свежак аромат характер уверенный душит стойкость высота 6 7 час кожа одежда вечер шлейф ловить пара раз спрашивать знакомство ниша идеально полный флакон дороговатый отлить стоить деньга советую
7,"Шикарный аромат: баланс фруктов и дымка. Стойкий, шлейф заметный. Однозначно стоит своих денег, Буду брать ещё",шикарный аромат баланс фрукт дымок стойкий шлейф заметный однозначно стоить деньга брать
8,"Легендарный парфюм, которым я горд. Запах мощный, сбалансированный, с отчетливыми нотами бергамота, ананаса и дубового мха. Создает вокруг ауру успеха и уверенности. Незаменим для деловых встреч и значимых мероприятий. Настоящая инвестиция в имидж успешного мужчины.",легендарный парфюм горд запах мощный сбалансированный отчётливый нота бергамот ананас дубовый мох создавать аура успех уверенность незаменимый деловой встреча значимый мероприятие инвестиция имидж успешный мужчина
9,"Ну что сказать. Это Авентус. Для меня флакон дороговат, поэтому беру отливант. И уже во второй раз. Часто хочется им просто облиться. Но это уже перебор. Настолько он крут для меня.",сказать авентус флакон дороговат брать отливант второй раз хотеться облиться перебор настолько крут
10,"Отличный аромат подходит ко всему!!! Приятно пахнет, очень стойкий, оставляет приятный шлейф, приятно носить!!!!",отличный аромат подходить приятно пахнуть стойкий оставлять приятный шлейф приятный носить
11,"Ну это шедевр, обожаю! Страстный, манкий, нежный! Собирает кучу комплиментов! Сейчас будет его время! Очень соблазнительный аромат и нравится мужчинам",шедевр обожать страстный манкий нежный собирать куча комплимент время соблазнительный аромат нравиться мужчина
12,"Это лучшие духи, что были в моей жизни, каждый день получаю комплименты. Чувствую себя очень сексуальной и привлекательной",хороший дух жизнь день получать комплимент чувствовать сексуальный привлекательный
13,"Я в восторге 😍 мне очень нравится 😍🤟Открытие года! Весеннее настроение, запах стойкий 👍Лёгкость ,свежесть ,аромат 🔥",восторг 😍 нравиться 😍 🤟 открытие год весенний настроение запах стойкий 👍 лёгкость свежесть аромат 🔥
14,"заказала на подарок подруге, нереально классный аромат, женственный, стойкий, шлейфовый, рекомендую к покупке",заказать подарок подруга нереально классный аромат женственный стойкий шлейфовый рекомендовать покупка
15,"Аромат топчик, за свои деньги совсем замечательно, привлекает всех вокруг, очень нравится и жене и детям",аромат топчик деньга замечательно привлекать нравиться жена ребёнок
16,"Изысканный аромат, раскрываются нотки постепенно, влюбилась с первого вздоха. Просто потрясающий аромат",изысканный аромат раскрываться нотка постепенно влюбиться первый вздох потрясать аромат
17,"Я в восторге от аромата! на мне держится очень долго, супер шлейфовый! схожу с ума от него! Буду брать еще.",восторг аромат держаться супер шлейфовый схожу ум брать
18,"Беру не первый раз. Киллиан это конечно, вышка в парфюмерии. Стойкий и очень красивый аромат. Очень нравится.",брать первый раз киллиан вышка парфюмерия стойкий красивый аромат нравиться
19,"Мне понравился! Сушёные абрикосы, держится долго, шлейф хороший, ну очень нравится! Сладкий вкусный , но очень сухой абрикос!",понравиться сушёный абрикос держаться шлейф хороший нравиться сладкий вкусный сухой абрикос
20,Крышесносный! Впервые услышана этот аромат у гостей сидящих за соседним столиком в ресторане. И поняла что влюбилась в него!,крышесносный впервые услышать аромат гость сидеть соседний столик ресторан понять влюбиться
21,"Обожаемый роскошный аромат в стиле Ганимеда, но нежный и вкусный, а не тошнотворный. Буду брать большой флакон",обожать роскошный аромат стиль ганимеда нежный вкусный тошнотворный брать большой флакон
22,"Получила миниатюрку этого аромата, давно уже хотела познакомиться с ним и не прогадала, Gaba шикарный аромат, любовь с первого пшика. Буду заказывать ещё.",получить миниатюрка аромат познакомиться прогадала gaba шикарный аромат любовь первый пшик заказывать
23,"Он прекрасен, это полный восторг!! Приобрела по отзывам и не пожалела. Все оперативно доставили ! Лёгкий, нежный, интересный",прекрасный полный восторг приобрести отзыв пожалеть оперативно доставить лёгкий нежный интересный
24,"💖Аромат шикарный, превзошел все ожидания!!! Стойкий, не навязчивый! Упаковка как всегда идеальна. Спасибо за возможность попробовать аромат без переплат)",💖 аромат шикарный превзойти ожидание стойкий навязчивый упаковка идеальный спасибо возможность попробовать аромат переплата
25,Давно хотела заказать этот аромат и я прям влюбилась в него с первого пшика🥰 Хочу теперь полноценный флакон🥰,заказать аромат влюбиться первый пшик 🥰 полноценный флакон 🥰
26,"This Is Not GABA оставляет ощущение загадочности и тонкой утончённости. Аромат необычный, с интересным сочетанием свежих и тёплых нот, будто раскрывается постепенно, каждый раз показывая что-то новое. Он лёгкий, но в то же время притягательный, создаёт атмосферу уверенности и индивидуальности. Отлично подойдёт тем, кто любит необычные и запоминающиеся ароматы.",this is not gaba оставлять ощущение загадочность тонкий утонченность аромат необычный интересный сочетание свежий тёплый нота раскрываться постепенно раз показывать новый лёгкий время притягательный создаёт атмосфера уверенность индивидуальность отлично подойти любить необычный запоминающиеся аромат
27,"Это просто🔥не зря сейчас это хит,не ожидала,что так понравится этот аромат,он не похож ни на что,действительно как дорогой глянцевый журнал,фруктовая нота звучит очень необычно и притягательно,однозначно повторю снова и снова",🔥 хит ожидать понравиться аромат похожий ни дорогой глянцевый журнал фруктовый нота звучать необычно притягательный однозначно повторить
28,"Изумительные, красивущие, стойкие духи! Парфюм просто бомба! Не могу описывать, но для меня это - шедевр! Я хочу его во флаконе и на долго! Спасибо!",изумительный красивущие стойкий дух парфюм бомба описывать шедевр флакон спасибо
29,"Стал один из самых любимых ароматов, в офис идеально! Спасибо рандеву, буду заказывать еще. Аромат очень шлейфовый, сотни комплиментов.",любимый аромат офис идеально спасибо рандеву заказывать аромат шлейфовый сотня комплимент
30,"Покупала своему мужчине и не прогадала! Отличный, оооочень вкусный аромат.. Напоминает горячий пирог с карамельными яблоками, просто вау!",покупать мужчина прогадала отличный оооочень вкусный аромат напоминать горячий пирог карамельный яблоками вау
31,"Kilian Angel's Share - интересный и, конечно, очень хайповый аромат - и в данном случае хайп оправдан. Восточный гурманский с цветочно-древесным оттенком, вкусный, яркий, богатый, но для меня - достаточно неоднозначный. Старт лёгкий и воздушный, с яркой цветочностью гедиона, к которой тут же добавляются коньяк и корица. Довольно быстро аромат теплеет и густеет: появляется древесность (дуб, сандал), усиливаются бобы тонка и ваниль. И вся композиция превращается в яблочную шарлотку с корицей, в которую щедро плеснули коньяка - ванильно-древесную, сладкую, с лёгким алкогольно-цветочным ореолом. В базе остаётся чистая гурманика: ваниль, пралине, мягкое дерево. Стойкость отличная - до 12 часов на моей коже. Шлейф заметный - от вытянутой руки до 2 метров. При всей изящности композиции для меня аромат смещён в женскую сторону: яркая цветочность и мягкая сладость делают его скорее про уют и чувственность, чем про характер и мужественность. В него хочется завернуться как в мягкий теплый плед - это аромат легкости, уюта и расслабления. И в этом для меня вся неоднозначность: как произведение искусства и как аромат настроения это прекрасно - как аромат на выход - только в исключительных случаях, в прохладный зимний или осенний вечер, на свидание, и под особое настроение. Моя оценка - 9 из 10.",kilian angel s share интересный хайповый аромат случай хайп оправдать восточный гурманский цветочный древесный оттенок вкусный яркий богатый достаточно неоднозначный старт лёгкий воздушный яркий цветочностью гедион добавляться коньяк корица быстро аромат теплеть густеть появляться древесность дуб сандал усиливаться боб тонка ваниль композиция превращаться яблочный шарлотка корица щедро плеснуть коньяк ванильный древесный сладкий лёгкий алкогольный цветочный ореол база оставаться чистый гурманика ваниль пралине мягкий дерево стойкость отличный 12 час кожа шлейф заметный вытянуть рука 2 метр изящность композиция аромат смещён женский сторона яркий цветочность мягкий сладость делать уют чувственность характер мужественность хотеться завернуться мягкий тёплый плед аромат лёгкость уют расслабление неоднозначность произведение искусство аромат настроение прекрасный аромат выход исключительный случай прохладный зимний осенний вечер свидание особый настроение оценка 9 10
32,"Любименький мой. Офлаконила конечно же. Осенью и зимой без него теперь просто не могу. Теплый, уютный аромат. Виски, яблочный пирог",любименький офлаконила осень зима тёплый уютный аромат виски яблочный пирог
33,"Очень яркий, восточный, комплиментарный! Взяла пробник, очень понравился аромат. Думаю о покупке большего объема",яркий восточный комплиментарный взять пробник понравиться аромат думать покупка больший объём
34,"Ну что тут говорить....это роскошь! Любовь любовная. Два раза покупала отливанты, думала наиграюсь, но нет. Офлаконила. Это роскошь, уют и комфорт во флаконе! Виски и яблочный пирог.",говорить роскошь любовь любовный два раз покупать отливанты думать наиграюсь офлаконила роскошь уют комфорт флакон виски яблочный пирог
35,"Обожаю этот аромат, готов обливаться им всегда, лично мне чувствуются яблоко и корица с небольшой коньячной нотой, что прям идеально для вечерних выходов или повседневной носке, но на осень или раннюю весну. Приятный, в меру сладкий, я бы сказал, что он идеальный.",обожать аромат готовый обливаться лично чувствуются яблоко корица небольшой коньячный нота идеально вечерний выход повседневный носка осень ранний весна приятный мера сладкий сказать идеальный
36,"Много слышал про него и все оказалось не зря. Очень вкусный парфюм. Теплый обволакивающий мед с корицей. Не парфюм, а уютный вечер под пледом возле камина",слышать оказаться вкусный парфюм тёплый обволакивающий мёд корица парфюм уютный вечер плед возле камин
37,"Любимый аромат для особого настроения. Аналогов ему много среди арабского парфюма, но не один не даёт такую лёгкость и переливчивость нот. искристый, пряный, алгогольный. Для меня замены ему нет.",любимый аромат особый настроение аналог арабский парфюм давать лёгкость переливчивость нота искристый пряный алгогольный замена
38,"Стойкость запредельно, насыщенный яркий аромат. Очень красивый , в зиму прям бомба. Шлейфовый, очень понравился.",стойкость запредельно насыщенный яркий аромат красивый зима бомба шлейфовый понравиться
39,"Запах невероятно притягательный! Тяжелый,но одновременно женственный аромат ! Неоднократно буду приобретать данный парфюм!",запах невероятно притягательный тяжёлый одновременно женственный аромат неоднократно приобретать парфюм
40,"Очень сладкий аромат, . Потрясающая стойкость, на моей холодной коже часов 10. Шлейфит очень хорошо.",сладкий аромат потрясать стойкость холодный кожа час 10 шлейфит
41,"Очень милый запах, казалось по нотам, что тут только зефирки, но нет, аромат интересный, очень подойдет в зимнее время",милый запах нотам зефирки аромат интересный подойти зимний время
42,"Взяла 100 мл, с дочкой на двоих, игристый, сладкий, легкий аромат. Не надоедает, хочется им обливаться.",взять 100 мл дочка двое игристый сладкий лёгкий аромат надоедать хотеться обливаться
43,"Прекрасный женственный аромат! Очень комплиментарный, приятный матовый флакон. Мягкое и пушистое облачко сахарной ваты, зефира и легкий цитрусовый аккорд. Стойкий и шлейфовый.",прекрасный женственный аромат комплиментарный приятный матовый флакон мягкий пушистый облачко сахарный вата зефир лёгкий цитрусовый аккорд стойкий шлейфовый
44,"Приятный, легкий, сладкий аромат ) подойдет на любое время года , и на каждый день будет отлично !))",приятный лёгкий сладкий аромат подойти время год день отлично
