id,review_text,cleaned_text
1346,"Скажу так - это ""горячий парфюм""! Очень притягательный. Для меня это аромат яблочной шарлотки, с добавлением корицы и карамели. Или аромат алкогольных конфет и запеченных яблок, политых алкогольным сиропом из коньяка",сказать горячий парфюм притягательный аромат яблочный шарлотка добавление корица карамель аромат алкогольный конфета запеченных яблоко полить алкогольный сироп коньяк
1347,Классный вкусный сочный малиновый ликер. Дорогущее звучание. Стойкость хорошая. Аромат прекрасного настроения. Абсолютный унисекс на всех раскрывается по-разному,классный вкусный сочный малиновый ликёр дорогущий звучание стойкость хороший аромат прекрасный настроение абсолютный унисекс раскрываться разный
1348,"Отличный парфюм, всю зиму с ним не расставалась! Мне понравился больше, чем классический Ангел, нет свербящей корицы, и больше, чем On the rocks, который для меня больше мужской. Но все 3 аромата имею для разного настроения. Paradis самый любимый, стойкость отличная!",отличный парфюм зима расставалась понравиться классический ангел свербеть корица on the rocks мужской 3 аромат иметь разный настроение paradis любимый стойкость отличный
1349,"Я не ожидал от этого аромата настолько мощную, взрывную волну на старте дорогого алкоголя, сладкого табака, корицы! Для меня это все так вкусно! Он настолько стойкий и шлейфовый, что вы не останетесь незаметным! Комплиментарный! Мне очень понравилось, буду брать ещё! Подходит холодное время и всё-таки он для мужчин!",ожидать аромат настолько мощный взрывной волна старт дорогой алкоголь сладкий табак корица вкусный настолько стойкий шлейфовый останетесь незаметный комплиментарный понравиться брать подходить холодный время мужчина
1350,"Это усовершенствованная версия классического Angels' Share, где добавили еще больше роскоши и глубины. Сразу чувствуешь этот ""дорогой"" коньяк и тонкую нотку малинового ликера. Это не приторно, а очень элегантно и притягательно",усовершенствованная версия классический angels share добавить роскошь глубина чувствовать дорогой коньяк тонкий нотка малиновый ликёр приторно элегантно притягательный
1351,"Моя любовь малиновый ликер! Люблю иногда смешивать с Гедонистом для придания кислинки) Желательно не перебарщивать с пшиками, он насыщенный аромат. Я делаю один пшик на шею сзади и один - на запястье",любовь малиновый ликёр любить смешивать гедонист придание кислинка желательный перебарщивать пшик насыщенный аромат делать пшик шея сзади запястье
1352,"Ощущается как уютный латте с лавандой. Не резкий черный кофе, а мягкая, сливочно-пудровая нежность. Аромат обволакивает, как любимый шерстяной свитер. Идеален для холодов, чтобы чувствовать себя в безопасности. Ненавязчивый, спокойный, очень комфортный.",ощущаться уютный латте лаванда резкий чёрный кофе мягкий сливочный пудровая нежность аромат обволакивать любимый шерстяной свитер идеален холод чувствовать безопасность ненавязчивый спокойный комфортный
1353,"Как же хорошо, что можно заказать пробники и попробовать поносить аромат на себе. Легкий, мягкий, уютный. Аромат состояния, когда никуда не надо спешить. Очень хорошо носить, когда нужно немного замедлиться.",заказать пробник попробовать поносить аромат лёгкий мягкий уютный аромат состояние спешить носить замедлиться
1354,"Как же я рада, что никаких пен для бритья не ощущаю в нем, да, он уверенный унисекс, но такой уютный и обволакивающий, кофейная пенка с ароматом лаванды, на фоне прекрасные бархатные бобы тонка, очень красиво, думаю о полноразмере",рад никакой пена бритьё ощущать уверенный унисекс уютный обволакивать кофейный пенка аромат лаванда фон прекрасный бархатный боб тонка красиво думать полноразмере
1355,"мечтаю о полном флаконе!!! самый лучший парфюм. я никогда не думала, что мне так понравится кофе в парфюмерии, просто восторг!",мечтать полный флакон хороший парфюм думать понравиться кофе парфюмерия восторг
1356,"Очень понравился аромат. Спасибо рандеву за возможность познакомиться с парфюмом купив пробник перед покупкой полного объема, что очень важно для меня.",понравиться аромат спасибо рандеву возможность познакомиться парфюм купить пробник покупка полный объём важный
1357,"Один из любимых и легендарных у бренда. Чувствую мягкую лаванду и кофе, лактонных ассоциаций нет. Унисекс",любимый легендарный бренд чувствовать мягкий лаванда кофе лактонных ассоциация унисекс
1358,"Кофейный, сладкий аромат придомовой пекарни. Очень понравился, долго держится и оставляет комплиментарный шлейф.",кофейный сладкий аромат придомовый пекарня понравиться держаться оставлять комплиментарный шлейф
1359,"Давно мечтал о кофейном аромате который был бы по-настоящему качественным и натуральным и наконец нашёл его. Coffee Break это уют и комфорт в флаконе, тёплый кофе с молоком, мягкий мускус и лёгкая древесная база. Всё вместе звучит так гармонично и так по-домашнему что хочется носить его каждый день без повода. Стойкость отличная, держится на коже очень долго. Это теперь мой обязательный аромат для осени и зимы и я уже заказал второй флакон в запас.",мечтать кофейный аромат настоящий качественный натуральный найти coffee break уют комфорт флакон тёплый кофе молоко мягкий мускус лёгкий древесный база вместе звучать гармонично домашний хотеться носить день повод стойкость отличный держаться кожа обязательный аромат осень зима заказать второй флакон запас
1360,"Свежий, кофейно-лавандовый аромат, не заявлена груша, но она здесь есть и очень вкусная, свежесть придает именно груша. Ассоциация с весной, когда всё расцветает, аромат чистоты, благоухания, нежности. Дорогой, статусный аромат.",свежий кофейный лавандовый аромат заявить груша вкусный свежесть придавать груша ассоциация весна расцветать аромат чистота благоухание нежность дорогой статусный аромат
1361,"очаровательный кофейный аромат, на мне хорошо сел: чувствую кофе и молочные ноты, лаванды совсем немного. Думаю возьму формат побольше. На коже держится недолго (или я быстро привыкла к нему). Рекомендую попробовать, меня очаровал!",очаровательный кофейный аромат сесть чувствовать кофе молочный нота лаванда думать возьму формат большой кожа держаться недолго быстро привыкнуть рекомендовать попробовать очаровать
1362,"не устану петь оды формату 8мл. На мой взгляд отличная версия табачного листа, немного даже вяленого. удивительно но данный аромат отлично миксуется с колкими, яркими ароматами, уравновешивая их. Для знакомства с табаком отличный вариант",устану петь оды формату 8мл взгляд отличный версия табачный лист вяленый удивительный аромат отлично миксуется колкий яркий аромат уравновешивать знакомство табак отличный вариант
1363,"Franck Boclet Tobacco это уютный восточный аромат с характером. Вначале чувствуется терпкая слива и имбирь, которые переходят в мягкое табачное сердце с гвоздикой . База из ванили и бензоина делает композицию очень теплой и обволакивающей . Многие сравнивают его с Tom Ford Tobacco Vanille, но находят его более интеллигентным и менее приторным . Идеальный выбор для прохладной погоды.",franck boclet tobacco уютный восточный аромат характер чувствоваться терпкий слива имбирь переходить мягкий табачный сердце гвоздика база ваниль бензоин делать композиция тёплый обволакивать сравнивать tom ford tobacco vanille находить интеллигентный приторный идеальный выбор прохладный погода
1364,"Аромат очень понравился, из табачных это мой явный фаворит! Табак с пряностями и древесными. Пахнет дороже чем стоит!",аромат понравиться табачный явный фаворит табак пряностями древесный пахнуть дорогой стоить
1365,"Мой любимый аромат табако ванили, в этом исполнение ваниль как будто немного с приятной кислинкой, отличный повседневный вариант на зиму",любимый аромат табако ванили исполнение ваниль приятной кислинка отличный повседневный вариант зима
1366,"Самый универсаоьный среди табачных, ничего не выпирает, собран очень хорошо. Не надоедает, шлейф средний, а вот стойкость очень хорошая, особенно конечно с одежды. На TF Tabacco Vanille похож, но только нюансами..Самодостаточный очень вкусный аромат. Уже классика. Рекомендую",универсаоьный табачный выпирать собрать надоедать шлейф средний стойкость хороший одежда tf tabacco vanille похожий нюансами самодостаточный вкусный аромат классик рекомендовать
1367,"Данный парфюм покупала вслепую , и не прогадала, шлейф огромный, очень приятный, ношу и я и муж, унисекс",парфюм покупать вслепую прогадала шлейф огромный приятный носить муж унисекс
1368,"Franck Boclet мой сигнатурный бренд. Тобако - это аромат на каждый день. Как только появится возможность купить флакон, сразу это сделаю. Потому что этот настольный парфюм должен быть у каждого человека, который любит ноту табака.",franck boclet сигнатурный бренд тобако аромат день появиться возможность купить флакон сделать настольный парфюм каждый человек любить нота табак
1369,"Тепло-сладкий и томно-дымный, густой и обволакивающий, по мне больше на холодное время года, на выходы и вечерние мероприятия!",тепло сладкий томно дымный густой обволакивать холодный время год выход вечерний мероприятие
1370,"Очень уютный табачный аромат. Пахнет как пряный глинтвейн чернослив, гвоздика, ваниль и трубочный табак . Многие сравнивают с Tom Ford Tobacco Vanille, но тут меньше сладости и больше пряностей .",уютный табачный аромат пахнуть пряный глинтвейн чернослив гвоздика ваниль трубочный табак сравнивать tom ford tobacco vanille сладость пряность
1371,"Очень уютный табачный аромат . Пахнет как пряный глинтвейн чернослив, гвоздика, ваниль и трубочный табак . Многие сравнивают с Tom Ford Tobacco Vanille, но тут меньше сладости и больше пряностей .",уютный табачный аромат пахнуть пряный глинтвейн чернослив гвоздика ваниль трубочный табак сравнивать tom ford tobacco vanille сладость пряность
1372,"Стал моим любимчиком, коллеги на работе постоянно спрашивают, чем так приятно пахнет. Упаковали отлично, флакон пришел целый. Однозначно рекомендую!",любимчик коллега работа постоянно спрашивать приятно пахнуть упаковали отлично флакон прийти целый однозначно рекомендовать
1373,"Заказываю не первый раз , беру тревел формат , так как удобно брать в сумочку и в путешествие .Готова покупать его всю жизнь , эта та самая база , которая нужна всем , ароматы на него наносятся бесподобно",заказывать первый раз бер тревел формат удобный брать сумочка путешествие готовый покупать жизнь база нужный аромат наносятся бесподобный
1374,"Этот аромат прямо классика zarkoparfume, где бы не появлялась, везде спрашивают что за аромат, собирает много комплиментов, использование его всесезонно, но я люблю его летом. Аромат чистоты, свежести. Однозначно рекомендую, куплю еще на раз.",аромат прямо классик zarkoparfume появляться спрашивать аромат собирать комплимент использование всесезонный любить лето аромат чистота свежесть однозначно рекомендовать купля раз
1375,"Любимый дневной парфюм, который никогда не надоедает. Совершенно не ощущается на коже, но великолепно раскрывается на волосах",любимый дневной парфюм надоедать совершенно ощущаться кожа великолепно раскрываться волос
1376,"Обволакивающий, чистый аромат. Кремовый я бы сказала. Никого не задушит, для повседневной носки смело. Один из любимчиков",обволакивать чистый аромат кремовый сказать задушить повседневный носка смело любимчик
1377,На мне неплохо раскрывается. Спасибо Рандеву за возможность заказать любимые ароматы в миниатюре! Благодаря вам моя библиотека ароматов постоянно пополняется и это отличная возможность расширять парфгоризонты!,неплохо раскрываться спасибо рандеву возможность заказать любимый аромат миниатюра библиотека аромат постоянно пополняться отличный возможность расширять парфгоризонты
1378,"Я уже писала отзыв на этот парфюм. Повторюсь, что на данный момент это мой любимый аромат. Тем, кто страдает мигренью идеален.",писать отзыв парфюм повторюсь момент любимый аромат страдать мигрень идеален
1379,"Это великолепный аромат! Он волшебный: свежий, шлейфовый, обволакивающий, такой чистый и звонкий! Очень понравился!",великолепный аромат волшебный свежий шлейфовый обволакивать чистый звонкий понравиться
1380,"До этого парфюма у меня не было ни одной молекулы. Но этот парфюм меня покорил. Чистый, древесный. Взяла сотку",парфюм ни молекула парфюм покорить чистый древесный взять сотка
1381,"прекрасный аромат на повседневную носку, можно миксовать с другими ароматами, стойкость также очень хорошая",прекрасный аромат повседневный носка миксовать аромат стойкость хороший
1382,"Покупался для якорения с морем, сработал на ура. Очень красивый пляжный аромат, свежий и сладкий одновременно",покупаться якорения море сработать красивый пляжный аромат свежий сладкий одновременно
1383,"Это невероятно! Один спрей и ты уже на пляже, тёплый бриз, солнце на коже, запах кокосового крема и солёного воздуха. Я никогда не думала, что аромат может так точно передать ощущение летнего отпуска. Ношу его в самые серые зимние дни и он моментально поднимает настроение. Лёгкий, радостный, живой. Beach Walk это не просто духи, это машина времени в лучший день лета.",невероятно спрей пляж тёплый бриз солнце кожа запах кокосовый крем солёный воздух думать аромат передать ощущение летний отпуск носить самые серый зимний день моментально поднимать настроение лёгкий радостный живой beach walk дух машина время хороший день лето
1384,"Покупала пробник, что бы понять подойдет или нет, спойлер : подошел, буду брать полный размер. Очень удобно, что можно покупать миниатюры",покупать пробник понять подойти спойлер подойти брать полный размер удобный покупать миниатюры
1385,"как же он прекрасен. обожаю ароматы реплики, все мне подошли, акватические, спокойные, приятные. он универсален и точно прекрасен, его необязательно носить только летом",прекрасный обожать аромат реплика подойти акватические спокойный приятные универсален прекрасный необязательный носить лето
1386,"невероятный аромат, первая ассоциация с жасминовым чаем с молоком, бризом и шумом моря. свежий, вкусный, сладкий. отлично подойдёт на постоянную носку и на весну, однозначный фаворит из линейки Реплика",невероятный аромат первый ассоциация жасминовый чай молоко бриз шум море свежий вкусный сладкий отлично подойти постоянный носка весна однозначный фаворит линейка реплика
1387,"Какой свежий, приятный аромат, веет свежестью лета и моря, хочет я купить полноразмер на лето. Восторг",свежий приятный аромат веять свежесть лето море хотеть купить полноразмер лето восторг
