id,review_text
879,"Взял версию Extrait и не прогадал. Если сравнивать с классическим The Hedonist, этот звучит намного плотнее и дороже Сам запах очень приятный: чувствуется свежесть имбиря и много классного дерева. Он не сладкий, очень современный и какой-то статусный. Пахнет чистотой и уверенностью"
880,"Простой, интересный парфюм. Подойдёт всем и на любой возраст. Рекомендую. Буду брать ещё. Лёгкий парфюм."
881,"безумно мне понравился, это любовь. сочные цитрусы, насыщенные, яркие, думаю летом ещё лучше раскроются, чем зимой"
882,"Яркие и солнечные цитрусы, цитрусовый лимонад и немного пляжа и белых цветов. Шлейфовый и стойкий, унисекс"
883,"Запах сицилийского лимона в сахаре. Вроде сладко, но сладко элегантно и красиво. Запах хорошего настроения и лета. Очень люблю брызгать на воротник зимней куртки, чтобы за холодом ощущать лето."
884,"Данный аромат заказывала мужу. Очень понравился, такой свежий цитрусовый. Держится долго, хватает пару пшыков."
885,"Один из самых любимых парфюмов на лето. Приобретала похожий аромат, очень нравился и по рекомендации взяла этот парфюм. Стойкость в несколько раз дольше, запах похож, но еще более многогранен, когда нанесла первый раз даже не поверила , что нашла похожий, но более стойкий. Очень жизнерадостный аромат, приятный, нежный. Точно повторю еще много раз, возьму 8 мл на лето"
886,"Любимый весенне-летний аромат. Так приятно весеннее солнышко ,раннее утро и я окутанная этим ароматом . Сицилия ,цитрусы ,легкость ,весна,чего так не хватает после долгой зимы ."
887,"Товар приобретен в виде пробника. Аромат сочный, яркий, цитрусовый очень понравился. Рассматриваю покупку полноценного флакона"
888,"Aромат Sicily идеально подходит для летнего сезона, когда хочется ощутить свободу и радость жизни. Он легко наносится, имеет хорошую стойкость и приятный шлейф. Рекомендуется тем, кто любит легкие и солнечные ароматы, способные поднять настроение и подарить приятные воспоминания о путешествиях."
889,"Очень приятный аромат! Свежий, цитрусовый, жизнерадостный. Интересно раскрывается и в холод и в жару. Затестила пробник на море - идеально, истратила очень быстро. Теперь думаю взять полноразмер."
890,"Очень классный аромат, нежный , обволакивающий . Не оставит без внимания ни женщин, ни мужчин ! Однозначно советую!"
891,"Взяла пробничек, и теперь хочу полноразмер. Очень мне зашел аромат. Запах напоминает мне детство, были похожие в молодости у мамы."
892,"Это мой фаворит среди ароматов этого парфдома,очень нежный и стойкий .хорош будет на весну лето,хотя я и зимой иногда его использую"
893,"Роскошный аромат на весну и лето. Он очень теплый, интимный, сидит близко к коже, мускус мягкий, не душащий"
894,"Все так гармонично сложено. Ни одна нота не выпирает. Звучит гармонично. Это какая то ода женственности. Очень и очень феминный. Вроде бы ничего особенного, но как же он притягателен. Им просто хочется поливаться. Аромат на каждый день. Он не орущий, не заполняет все вокруг. Шлейф средний"
895,"Окутывающий аромат тепла, нежности, солнца. Приобрела миниатюру зимой, сразу стал моим фаворитом. Он согревает, при этом аромат абсолютно деликатен, не знаю как поведет себя в теплое время года, но уверена, что хочу полноразмер в коллекцию. Однозначно ДА!"
896,Повторяю его уже 4 или 5 раз. Самый классный аромат на жаркое лето и весну. На Лайт Блю не похож. Sun Musk более нежный. В кремово-уходовом направлении. Очень комплиментарен.
897,"Ждала год, пока цена упадет. И вот аллилуйя! Он стоил того, чтобы ждать. Флакон очень красивый. Лучший для меня аромат чистоты, разложить который на ноты не могу. Он просто красивый, чистый, интимный. Но вот интересно, что на него постоянно мне делают комплименты, то есть шлейф есть, хотя я его на себе почти не чувствую и не имею привычки поливаться. Кто ищет аромат дорогого ухода и чистоты, однозначно пробовать. Но дать ему время. Сначала я не очень его поняла, а потом как поняла..."
898,"Сначала показался резким, травянисто-цветочным. Но через пару минут стал нежно-мускусным. Хочется в него уткнуться и дышать, ни о чем не думать, пусть весь мир подождет. Дарит какое-то спокойствие и тепло. Задумалась о полноразмере."
899,"Аромат лёгкий, нежный, окутывающий. Аромат летней теплой ночи. Не навязчивый, сидит близко. Рекомендую"
900,"купила целых два пробника, для меня это много. один улетел с упоением. сливочная копченая ваниль. я не очень люблю ваниль, когда она звучит дешево как из пакетика, тут другая история. очень комплементарный"
901,"Магнетический коктейль из бархатистого шоколада, пряной ванили и томных древесных нот. Соблазнительный, тёплый, почти осязаемый. Очень комплиментарный"
902,"Влюбил меня в себя этот аромат по уши, такой загадочный и манящий , хочется его нюхать и нюхать и нюхать"
903,Сексуальная и маркая благородная ваниль с характером и глубиной Благодарю Рандеву за возможность знакомится с ароматами в таком удобном мини-формате
904,"Любовная любовь! Название полностью оправдано, не могу утверждать что они шлейфовые, скорее близко к коже, но они прям секс во флаконе, мне очень понравились"
905,Вот это палитра. Первый раз в дьютике познакомился с ароматом. Пробник заказал и понял надо брать духи флаконом.
906,"Обволакивающий, тягучий аромат. Он настолько красив, ярок, что хочется его вдыхать и вдыхать. Раскрывается теплотой"
907,"Очень классный аромат, как и многие ароматы Initio. Глубокий, объемный, сексуальный, действительно афродизиак. Ванильный, пудровый, древесный, сладковатый, кожаный. Очень приятная пирамида, сдержанная по звучанию, не душащая, но при этом очень богато звучащая."
908,"Очень классный,красивый,очень очень стойкий аромат!Шлейф километровый!Аромат слышу и на следующий день после нанесения!"
909,"Красивый, сексуальный аромат. Очень стойкий. Теперь хочу приобрести флакон. Очень понравился, рекомендую"
910,"Прекрасный нежный аромат. Это сладкое яблочко во флаконе, вкусный пирог шарлотка, чувствуется сверху сахарная пудра. Очень гурманский аромат, прекрасен на зиму и чтобы побаловать себя чем то сладким !"
911,"Потрясающий аромат. На мне раскрылся постепенно: сначала яркий аромат яблок, а затем приятный шлейф из тёплого молочного теста. Очень вкусно"
912,Красивый аромат. Очень сладкое звонкое яблочко. Любители гурманики будут в восторге. Хватает одного пшика на весь день.
913,"Тёплый аромат яблочного пирога, очень уютный. Лучший выбор для осени, стойкость 7-8 часов. Советую всем!"
914,"Свежеиспеченный яблочный пирог, корица, ваниль и хрустящая золотистая корочка, любимый аромат на зиму, когда хочется уютно посидеть в ресторане"
915,"Ну яблочный пирог! Вот как называется, так и ощущается. Томленые сладкие яблочки, утопающие в пышном сдобном тесте, и корица сверху. Горячий, только из печки. Ммм..."
916,"Очень мягкий и обволакивающий аромат. Приятный и не душный. Печеное яблоко на своём месте. Для меня первый вдох - и сразу же домашняя выпечка, она ещё горячая, только что из духовки. Запах густой и вкусный. Слышны молочные и сливочные тёплые ноты, ореховые нюансы. И мне даже почудились апельсиновые засахаренные цукаты и сухофрукты( хотя они не заявлены). Есть там и какие-то пряности. Звучит очень приятно, нежно и уютно. Как это бывпет дома на кухне, когда мама печёт пирори. Красивый аромат. Ваниль точно присутствует. Корица совершенно невероятно звучит. Мне слвшится запах деревянной разделочной доски и сливочного масла. И как итог - чудесный, ароматный, горячий домашний яблочный пирог/ штрудель из сдобного теста, щедро посыпаный корицей. Гурманская история, но очень милая, уютная, мягкая, теплая и домашняя."
917,"Пахнет действительно тёплым яблочным пирогом, от которого ещё идёт пар! И всё это в деревянном протопленном доме, а на улице - мороз!"
918,"Яркий аромат яблочной шарлотки, потом конечно уходит в красивейшую специевую гурманика, теперь мне нужен целый флакон на осень !"
919,"Очень вкусный, гурманский аромат. Яблоко с корицей, с карамельной корочкой в очень пышной сдобе. Для меня аромат осени на все сто процентов."
920,"Очень вкусный аромат! Дарит хорошее настроение,очень стойкий и диффузный! На любое время мы года! Рекомендую!"
921,"Приятный, насыщенный, роскошный аромат. Ощущение чистоты и свежести, отличная стойкость, рекомендую к покупке."
922,"Это мой один из самых любимых ароматов !Любовь с первого пшыка. Мягкий цветочный аромат ,просто невероятный"
923,"аромат получила в подарок к заказу. очень приятно!! еще не распробовала, но с первого раза захотелось нанести еще раз. интересный"
924,Густой цветочный аромат. Отлично заиграет своими красками весной. Любителям цветочных аромат очень понравится. Отличная стойкость и шлейф.
925,"Прекрасный аромат. Стойкий, нежный. Маме покупала 8 мл и себе несколько раз уже. Не пользуюсь им каждый день пока, но иногда хочется именно его носить. И поэтому очень удобно 8 мл покупать, а не полный объем."
926,"Невероятно женственный, благородный и глубокий аромат. Белые цветы звучат чисто и утончённо, без излишней сладости. В нём чувствуется роскошь и элегантность, но при этом он не кричащий, а очень гармоничный. Стойкость отличная, шлейф красивый и мягкий. Это аромат про статус и внутреннее достоинство."
927,"Благородный белоцветочный запах. Уже классика от Амуаж. Звучит статусно, дорого, главное - не перебарщивать при нанесении. Тогда он будет звучать тонко и интеллигентно. На тёплое время года."
928,"Очень красивый цветочный аромат, нежный и манкий, придает весеннее настроение. Не навязчивый, легкий, можно в офис. Ассоциации: весна, легкость, молодость. Шлейф хороший, достаточно стойкий, чувствую его на себе долго."
929,"Здесь солирует тубероза, немного сливочная, скромная, хоть и солирует, но в глаза не лезет своим выпирающим Я. А вокруг нее строится букет из нежных ноток жасмина, воздушных лепестков гардении и звонкого ландыша. Цветы перетекают друг в друга и сохраняют на мне эту композицию достаточно долго. Шлейф нереально доооолгий."
930,"Цветущее персиковое дерево с нежнейшей ванилью и сливками. Это очень приятный, очень интимный аромат летнего утра. Это карамельный крем с едва уловимым персиковым флёром."
931,"Эти духи -просто бомба! Это аромат для тех, кто не боится быть собой, кто ценит естественность и легкую небрежность. Он такой притягательный, что хочется постоянно его вдыхать. Чувствуешь себя в нем одновременно расслабленной и невероятно сексуальной. Определенно, мой новый фаворит!"
932,"Очень женственно, маняще, притягательный парфюм. Пробник сносила моментально. Возьму пока 8 мл, ,для меня это вкуснейший персик с молоком."
933,"Пахнет чем-то очень хорошим🤗 Нежные карамельные персики, что-то уходовое. Но при этом достаточно яркое звучание, которое сменяется нежным и обволакивающим послевкусием. Брала миниатюру на пробу - распробовала, хочется ещё😅"
934,"Сексуальный аромат, близко к телу, не бьёт в нос, ненавязчивый, как вторая кожа. Надо брать. Хороший"
935,"Аромат мне понравился, он такой девчачий, нежный, для меня, как запах бархатистого крема. Комплиментарный."
936,"Манкий, сладко-цветочный аромат. Ненавязчивый, ощущается как молодая ухоженная девушка, нежащаяся в постели."
937,Очень женственный притягательный парфюм. Он такой гурманский. Ванильно-персиковый аккорд делает его очень уютным.
938,"Это очень мега притягательный аромат.Он немного сладкий но не приторный,сделали на него куча комплиментов.Мне пахнет в основном ванилью и десертом. Сидит мягко на коже и раскрывается постепенно,держиться долго на вещах.. К покупке рекомендую,кто любит сладкие ароматы.Мне больше зашел зимой."
939,"Очень сексуальный, красивый, уютный. Мое ароматное я. Обожаю и хочу флакон, на любое время года красив"
940,"Terroni это как запах костра в лесу после дождя. Дымный, землистый, с малиной и тёплым деревом. Очень стойкий, держится целый день и даже дольше. Шлейф сильный, люди оборачиваются. Смелый аромат, не всем зайдёт."
941,"Заказывали парфюм, пришел быстро, хорошо упакованный. Приятный аромат, долго держится. Остались довольны"
942,"Спасибо рандеву за возможность взять отливант за небольшой прайс. Аромат очень густой и сложный, но этим он и чарует, звучит как гранат в котелке на деревянном кострище, очень понравился. Офлаконюсь как только появится возможность"
943,"Если кратко, то это сорокалетний мужик в кожанке, который насобирал деревянную корзину ягод и потом пошёл на завод, начав вырезать детали из металла и попутно куря сигарету. Супер стойкость, шлейф. Ну и настроение."
944,"Просто лучший. Малина и огонь. Причем огонь от сигареты. Дымность и сладость. Летом будет душить, но зимой самое то"
945,"TERRONI это вулкан страсти в бутылке, вдохновленный сицилийской землей. Верхние ноты мандарина, бергамота и кофе взрываются свежестью и бодростью, переходя в сердце лаванды, герани и специй ароматное, как средиземноморский сад. База из пачули, сандала, ванили и шоколада дарит теплый, землистый шлейф с дымными оттенками, стойкий как лава. Держится 12+ часов, шлейф мощный, заполняет пространство. Унисекс, но с мужским характером для офиса, вечера или путешествий. Комплименты летят рекой! Флакон массивный, черный, как базальт. Идеален для холодного сезона. За такую глубину и экспрессию шедевр. 5/5!"
946,"Брутальный! - всё, что надо знать об этом аромате! Густой, горелый, серьезный, сильный. Малина и горящий костер."
947,"ОЧЕНЬ красивый аромат, мне он очень зашел, пахнет сжеными деревяшками, такого красивого звучания я не слышал"
948,"С первых секунд он звучит мощно: тёплый, дымный, почти жгучий. Здесь нет лёгкости только плотная древесно-смолистая глубина с оттенками тёмной сладости и горячей почвы. Со временем аромат становится чуть мягче, но сохраняет свою первобытную энергию. Шлейф насыщенный и заметный, стойкость отличная это тот случай, когда одного нанесения достаточно на весь день."
949,"очень крутой аромат. есть отдалено ноты мегамаре, тоже свежесть но другая. сильно восхищен им гораздо больше чем мегамаре. хочется наносить на себя раз за разом не только на выход но и дома! однозачно хочется большой флакон теперь"
950,"Тонкое, деликатное раскрытие. На моей коже выдаёт нежнейшую, чуть уловимую сирень, обрамлённую перчиком. Следом выходит розочка со слатинкой, чуть помадная. А база не замыливается, пахнет свежо и красиво! Для ранней весны идиальный аромат. С нанесением не перебарщиваю, наношу только на локтевые сгибы. Животинку не слышу, хотя нечего против не имею. Аромат не кричит, а поэтапно раскрывается переливами свежести и сладости. Очень красивый и сексуальный! В базе тихо угасащий жасмин, но не индольный, а кремовый. Романтичным натурам зайдёт, хотя всё индивидуально. Мне зашёл."
