id,review_text
486,"шикарный парфюм - безумно понравился - всё соответствует описанию, стойкость отличная, очень вкусный парфюм."
487,"Прелесть какой зимний праздничный даже новогодний аромат! Яблочко запеченное в карамели в ликерчике и веточкой или листочком чего-то свежего. Носим, любим."
488,"Классный жизнерадостный аромат для меня, звучит интересно в разную погоду. Стойкость хорошая, не давящий"
489,Любителям легкости и фужерности- это класс. На жене запах открылся яблоками и пряностями. Шлейфовый. Стойкие и долго не выветриваются
490,"Духи приехали оперативно. Упаковка оригинал, духи оригинал, только наклейка на флаконе отошла,но ничего криминального. Выбирал долго из орто париси, выбрал первыми взять этот аромат. Шлейф от него незабываемый, а сам аромат изысканный"
491,"Это океан во флаконе: солёные брызги, йодистые водоросли и прохладная озоновая свежесть. Смело и атмосферно"
492,"Пушка бомба. Предвосхитил все мои ожидания по описанию. Базовые ноты в самое сердце, красиво звучит."
493,"Свежий, многогранный аромат. Приобрела для мужа, он в восторге от этого парфюма. Стойкость отличная. Сама тоже пользуюсь"
494,"Спасибо огромное, за быструю доставку, всё соответствует описанию, хорошо упакован. Действительно оригинал, сыну очень понравился аромат!"
495,"Что сказать, пока самый любимый акватический аромат, сложнее и натуральнее пока не встречались. Появилось много бюджетных аналогов и сейчас много где можно учуять похожий запах, но пахнет в основном синтетикой. Кто разбирается сразу отличит оригинал от реплики"
496,"Настоящий концентрат холодного моря в этом флаконе - водоросли и морской ветер, при этом аромат стойкий, нужна всего капля"
497,"Море, песок, горячий воздух, очень свежий аромат и самую малость сладкий. Очень стойкий, одно распыление и благоухание на весь день."
498,"Тот случай, когда свежак действительно может быть стойким. Чтобы вы понимали его стойкость, вот первые молекулы Мегамаре были выброшены во вселенную после большого взрыва - аромат чувствуется всё еще. Акватический, зеленый, свежий, крутой!"
499,"очень понравились духи, как пахнут на мужчине. и даже на себя пшикнула - неплохо, вполне себе унисекс. пахнет прям морем и свежестью, но не банально."
500,"Аромат окутывает атмосферой уютного джаз-клуба с мягким, приглушённым освещением. В жару он может показаться слишком насыщенным, однако в прохладный вечер раскрывается наилучшим образом. Особенно гармоничен в осенние и зимние месяцы, когда погода располагает к тёплым и насыщенным ароматам. Шлейф парфюма ощущается достаточно ярко, но не навязчиво, создавая вокруг своего обладателя атмосферу уюта и уединения. Стойкость аромата впечатляет. Хотя он чаще ассоциируется с мужскими композициями, его также оценят женщины, предпочитающие дымные и глубокие ароматы с брутальными нотками."
501,"Очень крутой мужской аромат, пахнет дорогим алкоголем с табаком и нотками дыма Аромат уникальный и очень привлекательный!!!"
502,"Аромат с атмосферой мужика в кожанке, среди алкоголя в громком баре. Он не строгий, а более игривый."
503,"заказывала на подарок, не прогадала! очень необычный яркий аромат, прям мужской 😄 в целом вообще восторг!!!"
504,"это идеальный вечерний аромат с характером. С первых нот ощущаешь себя в уютном джаз-баре: сладковатый табак, теплый ром и древесная ваниль создают дымный, обволакивающий шлейф. Парфюм очень уютный, чувственный и не приторный. Держится отлично, оставляя после себя приятное послевкусие дорогого мужского одеколона из 90-х."
505,Аромат очень богатого мужчины в дорогом костюме с сигарой. Очень притягательный и шлейфовый. Всем советую попробовать
506,"Не просто парфюм, а портал в дымное, полутемное помещение, где смешиваются запахи хорошего виски, дорогих сигар и кожаных кресел. Это идеальный вечерний и холодный аромат для тех, кто ищет уют, тепло и нотку бунтарства. Очень характерный взрослый гурман, который может не подойти любителям легких цитрусовых композиций"
507,"Это шедевр. Я не знаю как ещё это описать. Наверное данный парфюм либо вызывает восторг, либо отталкивает. Красивейшая композиция. Скорее мужской парфюм, чем женский. Он окупает свою стоимость буквально за пару пшиков. Очень комплиментарный и стойкий"
508,"Обожаю, впринципе очень люблю весь бренд но джазз клаб это очень вкусно и универсально, на осень и весну лучше духов придумать не могу"
509,"Шикарный аромат, который полностью соответствует названию. Теплый, глубокий, дымный и сладковатый, 10/10"
510,"Аромат очень стойкий, что особенно приятно,он остается на коже весь день, даря ощущение уверенности и элегантности. Выглядят стильно и современно, что также добавляет ему привлекательности."
511,"Мой самый любимый аромат, с ним я всегда себя чувствую уверенно, мужчины делают комплименты, однозначно буду брать еще"
512,"Очень популярный аромат. Решила взять на пробу первый раз. Восхитительный, сладкий и стойкий. Я не разочаровалось. Доставка быстрая, как всегда. Спасибо!"
513,"Роскошный вечерний аромат, слаще и насыщеннее классики. Шлейф километровой, стойкость просто вечная."
514,"Потрясающий аромат, беру уже не в первый раз, обволакивающий, стойкий, уже ставший классическим. Попробовала в миниатюре, аромабоксе, позже взяла три флакончика по 8 мл, буду повторять снова. Спасибо Рандеву за такую возможность!"
515,"Мой самый любимый парфюм! Если бы можно было выбрать на всю жизнь только 1 парфюм - это был бы он. Он красивый, привлекательный, сладкий и манкий. Первый раз познакомилась с ним 8 лет назад. С того момента влюблена в него по уши!"
516,"Этот аромат моя любовь.! Вне всяких сомнений звучит роскошно и дорого. Это как раз тот случай, когда аромат способен задать тон и настроение."
517,"Как не крути классика и база. Версия экстракт нравиться больше, чем обычная. Ооочень шлейфовый роскошный запах. С ним всегда комплименты. Использую только по специальным памятным случаям, использую редко, чтобы они не потеряли свою ценность"
518,"Получила в подарок, это любовь с первых нот! 😍 Очень тонкий, лёгкий аромат, шафран, миндаль и мускус дают невероятное сочетание 🔥 Очень хочу офлаконть. Любителям оригинальных ни на что не похожих парфюмов тестить обязательно!"
519,"мой любимый аромат, что бы кто не говорил. никаких бинтов не чувствую.. только чарующий аромат, первый раз"
520,"Заказываю повторно. С ароматом у меня случилась любовь любовная. Звучит прекрасно и в офисе, и на отдыхе. Политкорректный, стойкий, пары пшиков хватает часов на 5.Спасибо за возможность приобрести в миниатюре."
521,"Первый раз решила попробовать аромат от Byredo. Это была любовь с первых нот! Такой осенний холодный аромат, обволакивает как туман. Как мне кажется идеален для пасмурных и дождливых дней. Определенно буду покупать еще."
522,"Один из самых красивых ароматов в бренда. Он и сладкий, и свежий, и древесный. Прохладный и благородный Благодарю рандеву за возможность знакомиться с ароматами в таком удобном мини-формате."
523,"Обожаю его за безупречный баланс цветочности и свежести. Уместен в любое время года и суток, совершенно не надоедает."
524,"Мой любимчик среди ароматов Байредо. Интеллигентный, немного пудровый, мягкий и элегантный. Постоянно хочется к нему возвращаться"
525,"Очень дорого выглядит упаковка, а аромат вообще огонь, самая лучшая цена среди крупных ритейлеров , спасибо RANDEWOO"
526,"Аромат, который вызывает прилив радостного предвкушения, словно в преддверии летнего праздника. Спустя время ощущаю грушу вместе с фиалкой, сладко, но не приторно. При использовании этого аромата непроизвольно хочется улыбнуться, ощущая его шлейф на себе"
527,Отличный аромат. В меру сладок. Цветочный. Подойдет на любое время года. Не душит своей насыщенностью. При этом шлефовый
528,Отличный красивый современный стойкий аромат.Очень универсальный унисекс.Спасибо любимый магазин за возможность покупать новые ароматы по более приемлемым ценам!
529,Один из моих любимых парфюмов. Сладко-свежий. Ненавязчивый и уютный аромат. Повседневный. Хорош в любой сезон. Повторяю многократно
530,"Ну вечная классика. Есть ощущение, что на каждом человеке раскрывается по-своему. Для меня похож на аромат чистоты."
531,"С первого раза не поняла в аромобоксе, второй аромабокс и все я пропала, эта горчинка очень стойкая, у меня 2 аромата молекулы и оба любовь в самое 💜❤"
532,"Постоянно беру первую и вторую молекулу, выбрать между ними не могу. Этот более ярче для меня, чем вторая молекула. Они оба не надоедают и хорошо совмещаются с другими ароматами."
533,"Это аромат на все случаи жизни. Прекрасный, тонкий и элегантный.Можно наносить соло, можно в комбинации с другими парфюмами. Просто любовь с первого вздоха, нежность и чистота."
534,"Оригинальный стойкий парфюм. Каждая Молекула хороша по-своему, но эта одна из любимых. Аромат незабываемый."
535,"Один из первых хитов среди молекулярных ароматов. На моей коже раскрывается очень красиво, нежно и при этом ярко. Нет отсылок к каким-то знакомым запахам, что мне очень нравится. Интересный, но как и любой аромат, может не подойти."
536,"Прекрасный и любимый аромат. Молекула не дает яркого шлейфового аромата - он звучит близко к коже и раскрывается индивидуально. На шарфе аромат ощущается по -другому. Прекрасный, любимый аромат. Аромат оригинальный, чему я особенно рада."
537,"Молекула- легендарный аромат , на всех раскрывается по своему ! Очень люблю , хорошо носить и женщинам и мужчинам"
538,"Моя любовь- Молекула 01, лёгкий, чистый аромат, универсальный, можно наносить, как самостоятельный, так и с любым ароматом, он усилит другой парфюм, сделает более мягким, вкусным, шлейфовым. На коже держится довольно долго, я его чувствую весь день, моя самая любимая молекула, теперь она у меня есть всегда, беру полноразмер, недавно был в продаже флакон 200 мл, но я не успела его приобрести, теперь очень жалею.Рандеву успехов и процветания!!! Замечательный магазин)))Спасибо вам!"
539,"Самая моя любимая молекула, тонкий аромат чистоты, ненавязчивый запах, обожаю её и постоянно заказываю"
540,"Отличный аромат. Подходит для деловых встреч. Невероятно стойкий, держится 10 дней минимум. Советую к покупке"
541,Отличный аромат для мужчин идеально подходит для важных событий или встреч.Купил в слепую и не пожалел
542,"Как же мне понравился этот аромат.Какой красивый уд, мягкий, воздушный....Зимой очень красиво звучит."
543,"Тот самый уд, который вы ищете. Не синтетический, без анималистики. Отшлифованный и мужественный. Стойкий с хорошим шлейфом."
544,Один из лучших удовых ароматов.Мощный и дерзкий.Стойкость и шлейф выше всяких похвал.Отличный аромат для вечернего выхода.
545,"Oud For Greatness (Initio) древесно восточный унисекс: уд, шафран, мускус, пачули. Мощный, стойкий, шлейфовый. Звучит дорого!"
546,"Очень нарядный аромат! Мне он нравится своим королевским, длинным и заметным шлейфом, привлекающим внимание с одного распыления"
547,"Потрясающий аромат, очень гармонично собран, красивый, стойкий. Кажется всё же больше в мужскую сторону."
548,OUD FOR GREATNESS это удовая симфония силы и величия. Верхние ноты лаванды шафрана мускатного ореха дают пряный свежий взрыв как пробуждение льва. Сердце натурального уда раскрывает глубокий дымный древесный рев полный животной мощи. База пачули мускуса и сандала оставляет теплый маслянистый шлейф гипнотический и царственный. Стойкость легендарная 12+ часов одежда пахнет неделю шлейф властный. Унисекс для холодных вечеров лидеров или ритуалов. Флакон черный минималистичный. Аромат вызывает трепет и комплименты за ауру успеха. За эпичность и глубину 5 из 5!
549,"Сначала бьет в нос густым, дорогим удом и специями, но через полчаса смягчается в нереально сексуальную, сладковатую шафрановую дымку. Стойкость убойная!"
550,"Шикарный парфюм. В итоге я его офлаконил, когда появились скидки. Начинал с отливантов , пришел к флакону. Он шикарен."
551,"Брала для брата, очень любит он этот аромат. Грейпфрут освежает, очень стойкий, стильный аромат для современного мужчины, дорогое звучание, для любого случая. Он берет уже третий раз его"
552,Освежающий грейпфрут с искристой имбирной нотой переходит в пряно-древесное сердце и чувственный мускусный шлейф Божественный эликсир свободы
553,"Огонь аромат, просто отличнейший свежак, атомайзер шикарный, лучше чем парфюмированная версия, оригинал!!!"
554,"Шикарный, свежий старт с искристыми цитрусами и изысканным древесно-пряной базой. Звучит очень дорого, ну, собственно, как и стоит. Очень элегантно и современно. Нравится на муже"
555,"Изысканный аромат впечатляет с самого первого вздоха, я не пожалел что купил его, буду брать еще, сразу видно что оригинал"
556,"Свежий, не тяжелый, универсальный. Подойдет для любого повода и на любой сезон. В нем чувствуется аристократизм и уверенность без наглости - нет излишнего напора, не утомляет, не душит. Очень приятный и гармоничный цитрусово-фужерный аромат."
557,"Это один из самых прекрасных парфюмов, что я только пробовал. Один из лучших вариантов для мужчин. Создается впечатление, что его можно использовать всегда и везде, при любом поводе и случае."
558,"Красивый аромат , брала для мужчины , но можно и женщинам пользоваться. Красивая цитрусовая нотка переплетается с цветочными . Мне нравится , когда на мужчине нежные ароматы. Прекрасно подойдет для юных мужчин."
559,"Заказал пару тройку 8 мл ароматов включая этот, некоторые в 2-3 раза дороже данного аромата, но с большим отрывом выиграл этот аромат, на лето будет огонь, закажу флакон. Дешево не значит плохо."
560,Очень зашел аромат. Сладкий богатый и вкусный. На каждый день самое то не кричащий не навязчивый и летний
561,"Благодаря Рандеву познакомилась с брендом и очень его полюбила! Аромат классный, сочнейшая клубника, очень яркий, сладкий"
562,"сладкая сочная клубника, которую щедро сдобрили взбитыми сливками и поставили рядом бокал искрящегося шампанского"
563,"Ооочень сладкий и вкусный! Спасибо, все доставили вовремя и приложили пробники в подарок!)) Буду заказывать снова у вас!"
564,"Потрясающий запах, очень нежный и приятный, будто пахнет клубничной жвачкой. Купила для теплых летних вечеров. Не могу дождаться их использовать."
565,"Мой любимый запах, заказала себе 8 мл, чтобы носить везде с собой и это было лучшим решением, теперь он всегда со мной"
566,"Шлейф,превосходный запах,просто отличные духи,стойкость тоже отличная,в эти парфюме все просто идеально"
567,"Самая вкусная клубника в сливках!!! Такой манящий, сладкий, летний аромат, очень вкусно. На холодное время тоже пойдет, но летом самое время считаю. Куплю еще раз обязательно!"
