id,review_text,cleaned_text
907,"Очень классный аромат, как и многие ароматы Initio. Глубокий, объемный, сексуальный, действительно афродизиак. Ванильный, пудровый, древесный, сладковатый, кожаный. Очень приятная пирамида, сдержанная по звучанию, не душащая, но при этом очень богато звучащая.",классный аромат аромат initio глубокий объёмный сексуальный афродизиак ванильный пудровый древесный сладковатый кожаный приятный пирамида сдержанный звучание душить богато звучать
908,"Очень классный,красивый,очень очень стойкий аромат!Шлейф километровый!Аромат слышу и на следующий день после нанесения!",классный красивый стойкий аромат шлейф километровый аромат слышать следующий день нанесение
909,"Красивый, сексуальный аромат. Очень стойкий. Теперь хочу приобрести флакон. Очень понравился, рекомендую",красивый сексуальный аромат стойкий приобрести флакон понравиться рекомендовать
910,"Прекрасный нежный аромат. Это сладкое яблочко во флаконе, вкусный пирог шарлотка, чувствуется сверху сахарная пудра. Очень гурманский аромат, прекрасен на зиму и чтобы побаловать себя чем то сладким !",прекрасный нежный аромат сладкий яблочко флакон вкусный пирог шарлотка чувствоваться сверху сахарный пудра гурманский аромат прекрасный зима побаловать сладкий
911,"Потрясающий аромат. На мне раскрылся постепенно: сначала яркий аромат яблок, а затем приятный шлейф из тёплого молочного теста. Очень вкусно",потрясающий аромат раскрыться постепенно яркий аромат яблоко приятный шлейф тёплый молочный тест вкусно
912,Красивый аромат. Очень сладкое звонкое яблочко. Любители гурманики будут в восторге. Хватает одного пшика на весь день.,красивый аромат сладкий звонкий яблочко любитель гурманики восторг хватать пшик день
913,"Тёплый аромат яблочного пирога, очень уютный. Лучший выбор для осени, стойкость 7-8 часов. Советую всем!",тёплый аромат яблочный пирог уютный хороший выбор осень стойкость 7 8 час советовать
914,"Свежеиспеченный яблочный пирог, корица, ваниль и хрустящая золотистая корочка, любимый аромат на зиму, когда хочется уютно посидеть в ресторане",свежеиспечённый яблочный пирог корица ваниль хрустеть золотистый корочка любимый аромат зима хотеться уютно посидеть ресторан
915,"Ну яблочный пирог! Вот как называется, так и ощущается. Томленые сладкие яблочки, утопающие в пышном сдобном тесте, и корица сверху. Горячий, только из печки. Ммм...",яблочный пирог называться ощущаться томлёный сладкий яблочки утопать пышный сдобный тест корица сверху горячий печка ммм
916,"Очень мягкий и обволакивающий аромат. Приятный и не душный. Печеное яблоко на своём месте. Для меня первый вдох - и сразу же домашняя выпечка, она ещё горячая, только что из духовки. Запах густой и вкусный. Слышны молочные и сливочные тёплые ноты, ореховые нюансы. И мне даже почудились апельсиновые засахаренные цукаты и сухофрукты( хотя они не заявлены). Есть там и какие-то пряности. Звучит очень приятно, нежно и уютно. Как это бывпет дома на кухне, когда мама печёт пирори. Красивый аромат. Ваниль точно присутствует. Корица совершенно невероятно звучит. Мне слвшится запах деревянной разделочной доски и сливочного масла. И как итог - чудесный, ароматный, горячий домашний яблочный пирог/ штрудель из сдобного теста, щедро посыпаный корицей. Гурманская история, но очень милая, уютная, мягкая, теплая и домашняя.",мягкий обволакивать аромат приятный душный печёный яблоко место первый вдох домашний выпечка горячий духовка запах густой вкусный слышный молочный сливочный тёплый нота ореховый нюанс почудиться апельсиновый засахаренные цукат сухофрукты заявить пряность звучать приятно нежно уютно бывпет дом кухня мама печёт пирори красивый аромат ваниль присутствовать корица совершенно невероятно звучать слвшится запах деревянный разделочный доска сливочный масло итог чудесный ароматный горячий домашний яблочный пирог штрудель сдобный тест щедро посыпаный корица гурманский история милый уютный мягкий тёплый домашний
917,"Пахнет действительно тёплым яблочным пирогом, от которого ещё идёт пар! И всё это в деревянном протопленном доме, а на улице - мороз!",пахнуть тёплый яблочный пирог идти пар деревянный протопленном дом улица мороз
918,"Яркий аромат яблочной шарлотки, потом конечно уходит в красивейшую специевую гурманика, теперь мне нужен целый флакон на осень !",яркий аромат яблочный шарлотка уходить красивый специевую гурманика нужный целый флакон осень
919,"Очень вкусный, гурманский аромат. Яблоко с корицей, с карамельной корочкой в очень пышной сдобе. Для меня аромат осени на все сто процентов.",вкусный гурманский аромат яблоко корица карамельный корочка пышный сдоба аромат осень сто процент
920,"Очень вкусный аромат! Дарит хорошее настроение,очень стойкий и диффузный! На любое время мы года! Рекомендую!",вкусный аромат дарить хороший настроение стойкий диффузный время год рекомендовать
921,"Приятный, насыщенный, роскошный аромат. Ощущение чистоты и свежести, отличная стойкость, рекомендую к покупке.",приятный насыщенный роскошный аромат ощущение чистота свежесть отличный стойкость рекомендовать покупка
922,"Это мой один из самых любимых ароматов !Любовь с первого пшыка. Мягкий цветочный аромат ,просто невероятный",любимый аромат любовь первый пшыка мягкий цветочный аромат невероятный
923,"аромат получила в подарок к заказу. очень приятно!! еще не распробовала, но с первого раза захотелось нанести еще раз. интересный",аромат получить подарок заказ приятный распробовала первый раз захотеться нанести раз интересный
924,Густой цветочный аромат. Отлично заиграет своими красками весной. Любителям цветочных аромат очень понравится. Отличная стойкость и шлейф.,густой цветочный аромат отлично заиграет краска весна любитель цветочный аромат понравиться отличный стойкость шлейф
925,"Прекрасный аромат. Стойкий, нежный. Маме покупала 8 мл и себе несколько раз уже. Не пользуюсь им каждый день пока, но иногда хочется именно его носить. И поэтому очень удобно 8 мл покупать, а не полный объем.",прекрасный аромат стойкий нежный мама покупать 8 мл раз пользоваться день хотеться носить удобный 8 мл покупать полный объём
926,"Невероятно женственный, благородный и глубокий аромат. Белые цветы звучат чисто и утончённо, без излишней сладости. В нём чувствуется роскошь и элегантность, но при этом он не кричащий, а очень гармоничный. Стойкость отличная, шлейф красивый и мягкий. Это аромат про статус и внутреннее достоинство.",невероятно женственный благородный глубокий аромат белый цветок звучать чисто утончённо излишний сладость чувствоваться роскошь элегантность кричать гармоничный стойкость отличный шлейф красивый мягкий аромат статус внутренний достоинство
927,"Благородный белоцветочный запах. Уже классика от Амуаж. Звучит статусно, дорого, главное - не перебарщивать при нанесении. Тогда он будет звучать тонко и интеллигентно. На тёплое время года.",благородный белоцветочный запах классик амуаж звучать статусный дорого главный перебарщивать нанесение звучать тонко интеллигентно тёплый время год
928,"Очень красивый цветочный аромат, нежный и манкий, придает весеннее настроение. Не навязчивый, легкий, можно в офис. Ассоциации: весна, легкость, молодость. Шлейф хороший, достаточно стойкий, чувствую его на себе долго.",красивый цветочный аромат нежный манкий придавать весенний настроение навязчивый лёгкий офис ассоциация весна лёгкость молодость шлейф хороший достаточно стойкий чувствовать
929,"Здесь солирует тубероза, немного сливочная, скромная, хоть и солирует, но в глаза не лезет своим выпирающим Я. А вокруг нее строится букет из нежных ноток жасмина, воздушных лепестков гардении и звонкого ландыша. Цветы перетекают друг в друга и сохраняют на мне эту композицию достаточно долго. Шлейф нереально доооолгий.",солировать тубероза сливочный скромный солировать глаз лезть выпирать строиться букет нежный нотка жасмин воздушный лепесток гардения звонкий ландыш цветок перетекать друг друга сохранять композиция достаточно шлейф нереально доооолгий
930,"Цветущее персиковое дерево с нежнейшей ванилью и сливками. Это очень приятный, очень интимный аромат летнего утра. Это карамельный крем с едва уловимым персиковым флёром.",цветущий персиковый дерево нежный ваниль сливками приятный интимный аромат летний утро карамельный крем уловимый персиковый флёр
931,"Эти духи -просто бомба! Это аромат для тех, кто не боится быть собой, кто ценит естественность и легкую небрежность. Он такой притягательный, что хочется постоянно его вдыхать. Чувствуешь себя в нем одновременно расслабленной и невероятно сексуальной. Определенно, мой новый фаворит!",дух бомба аромат бояться ценить естественность лёгкий небрежность притягательный хотеться постоянно вдыхать чувствовать одновременно расслабить невероятно сексуальный определенно новый фаворит
932,"Очень женственно, маняще, притягательный парфюм. Пробник сносила моментально. Возьму пока 8 мл, ,для меня это вкуснейший персик с молоком.",женственно манящий притягательный парфюм пробник сносить моментально возьму 8 мл вкусный персик молоко
933,"Пахнет чем-то очень хорошим🤗 Нежные карамельные персики, что-то уходовое. Но при этом достаточно яркое звучание, которое сменяется нежным и обволакивающим послевкусием. Брала миниатюру на пробу - распробовала, хочется ещё😅",пахнуть хороший 🤗 нежный карамельный персик уходовое достаточный яркий звучание сменяться нежный обволакивать послевкусие брать миниатюру проба распробовала хотеться 😅
934,"Сексуальный аромат, близко к телу, не бьёт в нос, ненавязчивый, как вторая кожа. Надо брать. Хороший",сексуальный аромат тело бьёт нос ненавязчивый второй кожа брать хороший
935,"Аромат мне понравился, он такой девчачий, нежный, для меня, как запах бархатистого крема. Комплиментарный.",аромат понравиться девчачий нежный запах бархатистый крем комплиментарный
936,"Манкий, сладко-цветочный аромат. Ненавязчивый, ощущается как молодая ухоженная девушка, нежащаяся в постели.",манкий сладко цветочный аромат ненавязчивый ощущаться молодой ухоженный девушка нежащаяся постель
937,Очень женственный притягательный парфюм. Он такой гурманский. Ванильно-персиковый аккорд делает его очень уютным.,женственный притягательный парфюм гурманский ванильный персиковый аккорд делать уютный
938,"Это очень мега притягательный аромат.Он немного сладкий но не приторный,сделали на него куча комплиментов.Мне пахнет в основном ванилью и десертом. Сидит мягко на коже и раскрывается постепенно,держиться долго на вещах.. К покупке рекомендую,кто любит сладкие ароматы.Мне больше зашел зимой.",мега притягательный аромат сладкий приторный сделать куча комплимент пахнуть основный ванилью десерт сидеть мягко кожа раскрываться постепенно держиться вещь покупка рекомендую любить сладкий аромат зайти зима
939,"Очень сексуальный, красивый, уютный. Мое ароматное я. Обожаю и хочу флакон, на любое время года красив",сексуальный красивый уютный ароматный обожать флакон время год красивый
940,"Terroni это как запах костра в лесу после дождя. Дымный, землистый, с малиной и тёплым деревом. Очень стойкий, держится целый день и даже дольше. Шлейф сильный, люди оборачиваются. Смелый аромат, не всем зайдёт.",terroni запах костёр лес дождь дымный землистый малиной тёплый дерево стойкий держаться целый день долгий шлейф сильный человек оборачиваться смелый аромат зайдёт
941,"Заказывали парфюм, пришел быстро, хорошо упакованный. Приятный аромат, долго держится. Остались довольны",заказывать парфюм прийти быстро упаковать приятный аромат держаться остаться довольный
942,"Спасибо рандеву за возможность взять отливант за небольшой прайс. Аромат очень густой и сложный, но этим он и чарует, звучит как гранат в котелке на деревянном кострище, очень понравился. Офлаконюсь как только появится возможность",спасибо рандеву возможность взять отливант небольшой прайс аромат густой сложный чаровать звучать гранат котелке деревянный кострище понравиться офлаконюсь появиться возможность
943,"Если кратко, то это сорокалетний мужик в кожанке, который насобирал деревянную корзину ягод и потом пошёл на завод, начав вырезать детали из металла и попутно куря сигарету. Супер стойкость, шлейф. Ну и настроение.",кратко сорокалетний мужик кожанке насобирать деревянный корзина ягода пойти завод начать вырезать деталь металл попутно курить сигарета супер стойкость шлейф настроение
944,"Просто лучший. Малина и огонь. Причем огонь от сигареты. Дымность и сладость. Летом будет душить, но зимой самое то",хороший малина огонь огонь сигарета дымность сладость лето душить зима
945,"TERRONI это вулкан страсти в бутылке, вдохновленный сицилийской землей. Верхние ноты мандарина, бергамота и кофе взрываются свежестью и бодростью, переходя в сердце лаванды, герани и специй ароматное, как средиземноморский сад. База из пачули, сандала, ванили и шоколада дарит теплый, землистый шлейф с дымными оттенками, стойкий как лава. Держится 12+ часов, шлейф мощный, заполняет пространство. Унисекс, но с мужским характером для офиса, вечера или путешествий. Комплименты летят рекой! Флакон массивный, черный, как базальт. Идеален для холодного сезона. За такую глубину и экспрессию шедевр. 5/5!",terroni вулкан страсть бутылка вдохновить сицилийский земля верхний нота мандарин бергамот кофе взрываться свежесть бодрость переходить сердце лаванда герань специя ароматный средиземноморский сад база пачули сандала ванили шоколада дарить тёплый землистый шлейф дымный оттенок стойкий лава держаться 12 час шлейф мощный заполнять пространство унисекс мужской характер офис вечер путешествие комплимент лететь река флакон массивный чёрный базальт идеален холодный сезон глубина экспрессия шедевр 5 5
946,"Брутальный! - всё, что надо знать об этом аромате! Густой, горелый, серьезный, сильный. Малина и горящий костер.",брутальный знать аромат густой горелый серьёзный сильный малина гореть костёр
947,"ОЧЕНЬ красивый аромат, мне он очень зашел, пахнет сжеными деревяшками, такого красивого звучания я не слышал",красивый аромат зайти пахнуть сжеными деревяшками красивый звучание слышать
