id,review_text,cleaned_text
458,"Девочки , это просто бомба!! Еще лучше, чем обычная версия. Многие интересуются, что у меня за аромат. Очень советую!",девочка бомба хороший обычный версия интересоваться аромат советую
459,"Я 6 лет назад познакомилась с этим ароматом Очень понравился Прямо-мой Много кто всегда спрашивал ,что за парфюм? Все западали на него,как только слышали на мне Очень люблю В целом бренд Килиан сам по себе отличный Благодаря боксу Я узнала,какие флакончики мне надо приобрести)",6 год познакомиться аромат понравиться прямо спрашивать парфюм западать слышать любить целое бренд килиан отличный бокс узнать флакончик приобрести
460,"Очень понравился аромат. Молекулярный, звенящий. Просто восторг. Использую как соло, так и в сочетании с другими. Очень стойкие и шлейфовые. Купила сразу же после 8мл полноразмер",понравиться аромат молекулярный звенеть восторг использовать соло сочетание стойкий шлейфовые купить 8мл полноразмер
461,"Аромат мягкий нежный, почти не слышный, нужно прижиматься близко что бы насладиться им, я его использую распрыскивая на волосы детей, у меня 7 и 9 летние, очень приятно при обнимании погружаться в волосы и вдыхать этот нежный свежий вкус.",аромат мягкий нежный слышный прижиматься насладиться использовать распрыскивать волос ребёнок 7 9 летний приятный обнимание погружаться волос вдыхать нежный свежий вкус
462,"Прекрасный аромат чистоты. Очень стойкие. Для меня аромат чистого тела и весны. Пахнет свежестью, а когда раскрываются тонкий запах цветов",прекрасный аромат чистота стойкий аромат чистый тело весна пахнуть свежесть раскрываться тонкий запах цвет
463,"Пахнет божественно, свежо, с потрясающим шлейфом. Собирает комплименты, подходит на любое время года, после миниатюр - офлаконила. Любителям молекулярных ароматов зайдет",пахнуть божественно свежо потрясающим шлейф собирать комплимент подходить время год миниатюра офлаконила любитель молекулярный аромат зайти
464,"Быстро влюбилась в данный аромат. Он на каждый день, ненавязчивый, но со своим характером. Куплю большой флакон.",быстро влюбиться аромат день ненавязчивый характер куплю большой флакон
465,"Заказываю не первый раз , беру тревел формат , так как удобно брать в сумочку и в путешествие .Самый любимый аромат , такой свежий , будто вышла на мороз и вдохнула свежего воздуха , особенно люблю зимой",заказывать первый раз бер тревел формат удобный брать сумочка путешествие любимый аромат свежий выйти мороз вдохнуть свежий воздух любить зима
466,"Я готова петь оды этому аромату вечно, для меня это аромат свежести и чистоты, всегда повторяю и думаю не перестану",готовый петь оды аромат вечно аромат свежесть чистота повторять думать перестать
467,"Заказывала для коллеги. Кто любит Not a Perfume - это must-have, усиленный вариант. Очень яркий, отличный свежий шлейф. Коробка крупная, красивая, эффектно на подарок.",заказывать коллега любить not a perfume must have усилить вариант яркий отличный свежий шлейф коробка крупный красивый эффектно подарок
468,"Теперь это моя любовь!!! Очень нежный, чистый аромат,на прохладную погоду идеально, в жару думаю тоже подойдут)",любовь нежный чистый аромат прохладный погода идеально жара думать подойти
469,"Очень понравился парфюм! Насыщенный, более яркий, чем классическая версия. Отлично подойдет на лето!",понравиться парфюм насыщенный яркий классический версия отлично подойти лето
470,"Аромат на все случае жизни. Ненавязчивый, но очень нежный и притягательный. Подойдёт даже для самых юных девушек",аромат случай жизнь ненавязчивый нежный притягательный подойти юный девушка
471,Фантастический весенний аромат... очень стойкий и прекрасно раскрывающийся на теле. Один из моих фаворитов этого бренда,фантастический весенний аромат стойкий прекрасно раскрывающийся тело фаворит бренд
472,"летний, солнечный и фруктовый аромат. Невероятная стойкость и шлейфовость. Самый комплиментарный парфюм бренда",летний солнечный фруктовый аромат невероятный стойкость шлейфовость комплиментарный парфюм бренд
473,Очень вкусный фруктов-цветочный аромат. Это стопроцентное попадание. Закажу полный размер на весну и раннее лето.,вкусный фрукт цветочный аромат стопроцентный попадание заказать полный размер весна ранний лето
474,"Приятный тёплый цветочный аромат с изюминкой, им хочется наслаждаться, остаётся приличный не удушающий шлейф",приятный тёплый цветочный аромат изюминка хотеться наслаждаться оставаться приличный удушать шлейф
475,"Этот аромат точно мой! Вот не надышаться.Для меня это несомненно летний аромат, солнечный, южный, пяжный, отпускной!",аромат надышаться несомненно летний аромат солнечный южный пяжный отпускной
476,"Аромат просто потрясающий и сводит с ума всех окружающих, такой обволакивающий и настолько притягательный)",аромат потрясающий сводить ум окружающих обволакивать настолько притягательный
477,"Взяла пробничек на пробу. У меня просто нет слов... Этот восхитительный, нежный цветочно-фруктовый аромат попал в моё сердечко! Лёгкий, ненавязчивый. Стойкий. Мне кажется на весну будет просто изумительно. Обязательно куплю флакон!!!",взять пробничек проба слово восхитительный нежный цветочный фруктовый аромат попасть сердечко лёгкий ненавязчивый стойкий весна изумительно обязательно купить флакон
478,"Прекрасный аромат, интересный, не заезженный. Достаточно стойкий, открывается такой цветочной фантазией, не навязчиво, нежно, не душит. На весну самое то.",прекрасный аромат интересный заезженный достаточно стойкий открываться цветочный фантазия навязчивый нежно душит весна
479,"Аромат очень нравится. Он такой манящий, женственный, головокружащий. Главное не переборщить, потому что аромат насыщенный и громкий.",аромат нравиться манящий женственный головокружащий главный переборщить аромат насыщенный громкий
480,"Это однозначно моя любовь. Все вокруг спрашивают про него. Яблоко, коньяк, шлейф лёгкий и шикарный. Рекомендую",однозначно любовь спрашивать яблоко коньяк шлейф лёгкий шикарный рекомендовать
481,"Очень крутые , шлейфовые , пахнет яблоком и бренди очень вкусный аромат подходит больше Для вечера , манящий",крутой шлейфовые пахнуть яблоком бренди вкусный аромат подходить вечер манить
482,"Прекрасный аромат,брала вслепую просто для того,чтобы заполнить набор миниатюр Оказался любимчиком в коллекции,свежий,фужерный,на каждый день",прекрасный аромат брать вслепую заполнить набор миниатюра оказаться любимчик коллекция свежий фужерный день
483,Очень люблю яблоко корица бренди. Унисекс думаю подойдет и мужчинам и женщинам. Очень стойкие. Отличный запах,любить яблоко корица бренди унисекс думать подойти мужчина женщина стойкий отличный запах
484,"Уже оставляла отзыв, но повторюсь, это прекрасный, теплый, осенний аромат яблочного пирога. Стойкие и очень насыщенные духи.",оставлять отзыв повториться прекрасный тёплый осенний аромат яблочный пирог стойкий насыщенный дух
485,"Вкусный, сладкий аромат яблочного пирога. Теплый и манящий, с легкой алкогольной ноткой. Вечерний, стойкий и шлейфовый. Очень понравился!",вкусный сладкий аромат яблочный пирог тёплый манить лёгкий алкогольный нотка вечерний стойкий шлейфовый понравиться
486,"шикарный парфюм - безумно понравился - всё соответствует описанию, стойкость отличная, очень вкусный парфюм.",шикарный парфюм безумно понравиться соответствовать описание стойкость отличный вкусный парфюм
487,"Прелесть какой зимний праздничный даже новогодний аромат! Яблочко запеченное в карамели в ликерчике и веточкой или листочком чего-то свежего. Носим, любим.",прелесть зимний праздничный новогодний аромат яблочко запечь карамели ликерчике веточкой листочек свежий носим любить
488,"Классный жизнерадостный аромат для меня, звучит интересно в разную погоду. Стойкость хорошая, не давящий",классный жизнерадостный аромат звучать интересный разный погода стойкость хороший давить
489,Любителям легкости и фужерности- это класс. На жене запах открылся яблоками и пряностями. Шлейфовый. Стойкие и долго не выветриваются,любитель лёгкость фужерности класс жена запах открыться яблоками пряностями шлейфовый стойкий выветриваться
490,"Духи приехали оперативно. Упаковка оригинал, духи оригинал, только наклейка на флаконе отошла,но ничего криминального. Выбирал долго из орто париси, выбрал первыми взять этот аромат. Шлейф от него незабываемый, а сам аромат изысканный",дух приехать оперативно упаковка оригинал духи оригинал наклейка флакон отойти криминальный выбирать орто париси выбрать первый взять аромат шлейф незабываемый аромат изысканный
491,"Это океан во флаконе: солёные брызги, йодистые водоросли и прохладная озоновая свежесть. Смело и атмосферно",океан флакон солёный брызги йодистый водоросль прохладный озоновый свежесть смело атмосферный
492,"Пушка бомба. Предвосхитил все мои ожидания по описанию. Базовые ноты в самое сердце, красиво звучит.",пушка бомба предвосхитить ожидание описание базовый нота сердце красиво звучать
493,"Свежий, многогранный аромат. Приобрела для мужа, он в восторге от этого парфюма. Стойкость отличная. Сама тоже пользуюсь",свежий многогранный аромат приобрести муж восторг парфюм стойкость отличный пользоваться
494,"Спасибо огромное, за быструю доставку, всё соответствует описанию, хорошо упакован. Действительно оригинал, сыну очень понравился аромат!",спасибо огромный быстрый доставка соответствовать описание упаковать оригинал сын понравиться аромат
495,"Что сказать, пока самый любимый акватический аромат, сложнее и натуральнее пока не встречались. Появилось много бюджетных аналогов и сейчас много где можно учуять похожий запах, но пахнет в основном синтетикой. Кто разбирается сразу отличит оригинал от реплики",сказать любимый акватический аромат сложный натуральный встречаться появиться бюджетный аналог учуять похожий запах пахнуть основный синтетика разбираться отличить оригинал реплика
496,"Настоящий концентрат холодного моря в этом флаконе - водоросли и морской ветер, при этом аромат стойкий, нужна всего капля",концентрат холодный море флакон водоросль морской ветер аромат стойкий нужный капля
497,"Море, песок, горячий воздух, очень свежий аромат и самую малость сладкий. Очень стойкий, одно распыление и благоухание на весь день.",море песок горячий воздух свежий аромат самую малость сладкий стойкий распыление благоухание день
498,"Тот случай, когда свежак действительно может быть стойким. Чтобы вы понимали его стойкость, вот первые молекулы Мегамаре были выброшены во вселенную после большого взрыва - аромат чувствуется всё еще. Акватический, зеленый, свежий, крутой!",случай свежак стойкий понимать стойкость первый молекула мегамаре выбросить вселенную большой взрыв аромат чувствоваться акватический зелёный свежий крутой
499,"очень понравились духи, как пахнут на мужчине. и даже на себя пшикнула - неплохо, вполне себе унисекс. пахнет прям морем и свежестью, но не банально.",понравиться дух пахнуть мужчина пшикнула неплохо унисекс пахнуть море свежесть банально
500,"Аромат окутывает атмосферой уютного джаз-клуба с мягким, приглушённым освещением. В жару он может показаться слишком насыщенным, однако в прохладный вечер раскрывается наилучшим образом. Особенно гармоничен в осенние и зимние месяцы, когда погода располагает к тёплым и насыщенным ароматам. Шлейф парфюма ощущается достаточно ярко, но не навязчиво, создавая вокруг своего обладателя атмосферу уюта и уединения. Стойкость аромата впечатляет. Хотя он чаще ассоциируется с мужскими композициями, его также оценят женщины, предпочитающие дымные и глубокие ароматы с брутальными нотками.",аромат окутывать атмосфера уютный джаз клуб мягкий приглушённым освещение жара показаться насыщенный прохладный вечер раскрываться хороший образ гармоничный осенние зимний месяц погода располагать тёплый насыщенный аромат шлейф парфюм ощущаться достаточно ярко навязчивый создавать обладатель атмосфера уют уединение стойкость аромат впечатлять ассоциироваться мужской композиция оценить женщина предпочитать дымный глубокий аромат брутальный нотка
501,"Очень крутой мужской аромат, пахнет дорогим алкоголем с табаком и нотками дыма Аромат уникальный и очень привлекательный!!!",крутой мужской аромат пахнуть дорогой алкоголь табак нотками дым аромат уникальный привлекательный
502,"Аромат с атмосферой мужика в кожанке, среди алкоголя в громком баре. Он не строгий, а более игривый.",аромат атмосфера мужик кожанке алкоголь громкий бар строгий игривый
503,"заказывала на подарок, не прогадала! очень необычный яркий аромат, прям мужской 😄 в целом вообще восторг!!!",заказывать подарок прогадала необычный яркий аромат мужской 😄 целое восторг
504,"это идеальный вечерний аромат с характером. С первых нот ощущаешь себя в уютном джаз-баре: сладковатый табак, теплый ром и древесная ваниль создают дымный, обволакивающий шлейф. Парфюм очень уютный, чувственный и не приторный. Держится отлично, оставляя после себя приятное послевкусие дорогого мужского одеколона из 90-х.",идеальный вечерний аромат характер первый нота ощущать уютный джаз бар сладковатый табак тёплый ром древесный ваниль создавать дымный обволакивать шлейф парфюм уютный чувственный приторный держаться отлично оставлять приятный послевкусие дорогой мужской одеколон 90
505,Аромат очень богатого мужчины в дорогом костюме с сигарой. Очень притягательный и шлейфовый. Всем советую попробовать,аромат богатый мужчина дорогой костюм сигара притягательный шлейфовый советую попробовать
506,"Не просто парфюм, а портал в дымное, полутемное помещение, где смешиваются запахи хорошего виски, дорогих сигар и кожаных кресел. Это идеальный вечерний и холодный аромат для тех, кто ищет уют, тепло и нотку бунтарства. Очень характерный взрослый гурман, который может не подойти любителям легких цитрусовых композиций",парфюм портал дымный полутёмный помещение смешиваться запах хороший виски дорогой сигара кожаный кресло идеальный вечерний холодный аромат искать уют тепло нотка бунтарство характерный взрослый гурман подойти любитель лёгкий цитрусовый композиция
