id,review_text
1270,"Во флакончике пахнет просто волшебно! Сложно даже как-то это описать словами. Приятная свежесть припыоенная сладостью какао и всё это без сахарной приторности. Духи по ощущениям как самый настоящий шёлк, название не обманывает. Я на сильна в различении нюансов, обычно ориентируюсь на нравится/не нравится, и эти, безусловно, понравились. На коже история немного другая, раскрылось больше какао без свежих деталей, но даже так очень приятный аромат. Не жалею, что попробовала его."
1271,"В начале чувствуется терпковатая сладость чёрной смородины, затем появляется сливочность, немного какао, островатая роза... Думаю, многим парфюм очень понравится - сексуальный, манкий, женственный! Но для меня он оказался слишком сладковатый и даже немного приторный, ожидала более мягкого, тёплого, каштанового... Напомнил 'Чувственную Орхидею"" (Sensual Orchid) от LM Parfums, там похожая история..."
1272,"Пахнет яблочным кальяном, очень вкусно и необычно. Несколько человек делали комплименты и спрашивали название."
1273,"Мой самый любимый парфюм зимой, запах яблочного кальяна окутывает и согревает будто, он супер комплиментарный, восхитительный"
1274,"Влюблена в этот аромат , очень бы хотелось полноразмерную версию, но не для себя, а для мужа . Нравится безумно как пахнет на нем. Сначала ярко слышны кальянные ноты, минут через 20 стихает, а дальнейшие ноты меня сводят с ума."
1275,"Для меня это аромат яблочной шарлотки с корицей, очень теплый, пряный и вкусный. Больше вижу на женщине, но возможно какому-то мужчине под костюм или официальную одежду тоже подойдет"
1276,"Это роскошь, получаю кучу комплиментов, этот парфюм невозможно не любить, обожаю, пользуюсь им в холодное время года , но и в теплое можно использовать вечером куда-нибудь на выход!"
1277,"Очень крутой аромат яблока, корицы и дыма. Не сказала бы, что это кальянный запах, это скорее яблочный пирог, не приторный, немного с кислинкой, и немного запаха дыма от табака. Очень долго разнашивала пробник, в морозы сидел очень вкусно и раскрывался вишневыми оттенками, хоть в пирамиде они и не заявлены. Стойкость очень хорошая, держался весь день, с утра до вечера."
1278,"В начале дымность очень яркая, напоминающая дым от кальяна смешанный с нотками зелёного яблока и лёгкий сладковатый табак. В целом, это гурманский и качественный парфюм. Аромат держится очень долго и имеет хорошую проекцию."
1279,"KILIAN Smoking Hot это любовь с первого вдоха! Пряный дым, сладкое яблоко и благородный табак сливаются воедино с мягкой ванилью. Очень атмосферный, стойкий и чувственный унисекс. Хочется дышать бесконечно!"
1280,"Достойный мужской аромат. Зимой супер! Дорогой вечерний аромат, чувствуется дорогой коньяк с мёдом и корицей."
1281,"Совсем не поклонник фруктов в парфюме. Но здесь - эта тонкая, изящная табачная нотка, обрамленная подкопченным яблочком, просто сводит с ума. Аромат хочется вдыхать, им хочется наслаждаться. Слишком часто носить - надоест, на выход самое то. Цена конечно кусается, но попробуйте найти ему альтернативу. Фрукты с табаком, как ни странно, отнюдь не тривиальная история для парф-индустрии."
1282,"Psychedelic Love смелый, эмоциональный и притягательный аромат. С первых нот ощущается яркая сладость и терпкие фруктовые акценты, которые постепенно переходят в тёплые пряные и амбровые оттенки. Аромат звучит глубоко, необычно и завораживающе. Идеален для вечера, особых случаев и холодного времени года. Стойкость высокая, шлейф насыщенный и запоминающийся. Psychedelic Love про страсть, уверенность и магию мгновения."
1283,"Шикарный вечерний аромат, который сшибает с ног. Притягивает носы всех вокруг мужчин. Покоряет их сердца"
1284,"ой, любовь любовь любовь! очень сексуальный запах! прям наносишь его и чувствуешь себя прям кошечкой. шлейф не сказать , что большой. на себе чувствую пару часов."
1285,"Очень крутой аромат ! Я довольна на 100. процентов , стойкость супер и точно как в оригинале шлейф есть невероятная"
1286,"Очень нежный! Основной акцент в аромате сделан на сливочном гелиотропе, в сочетании с сандалом он дает эффект пудры из миндаля, что ощущается как дорогое уходовое средство, также в нем есть медовые цветы и нота розы"
1287,Женский очень чувственный аромат. В меру сладкий и свежий. Композиция очень интересная. На любое время года
1288,"Лет 5-6 назад его тестила в магазине, сначала показался тяжеловатым, но дала ему шанс раскрыться. Приехала домой, еще раз послушала на запястье и это был какой-то манящий, психоделический аромат, реально. Но, в магазине, не было дорожного формата, и не стала брать. На рандеву очень нравится что есть по 8 мл, как раз такой купила (сумочный вариант), очень удобно. Еще заказала арома бокс, и там был очень красивый флакон, золотого цвета, как раз для формата 8 мл. Упаковала парфюм в него, и это ну очень шикарно выглядит."
1289,"Афродизиак, класс. Спасибо Рандеву за возможность заказать любимые ароматы в миниатюре! Благодаря вам моя библиотека ароматов постоянно пополняется и это отличная возможность расширять парфгоризонты!"
1290,"Один из самых моих любимых парфюмов, томная кальянная вишня с табаком, ну очень красивый аромат и шлейф, пора покупать целый флакон."
1291,"Манящий, загадочный и чарующий аромат. Томная вишня в специях, это что-то! Обязательно приобрету себе целый флакон."
1292,"Купила полный флакон, как это прекрасно! нагретая на солнце дынька сочная и медовая, создает волшебное настроение, обожаю :)"
1293,"Это одна из самых реалистичных дынь в парфюмерии . И что не мало важно, ноты дыни достаточно долго не уходят и только к базе остается ваниль."
1294,"Гурманский аромат, красивый, необычный. Главенствует, конечно, дыня. Я убедилась, что не люблю дыню в ароматах, поэтому мимо"
1295,"Ярко,вкусно,правдоподобно.Персика и других заявленных экзотических фруктов не слышу,на всем протяжении это спелая сочная дыня."
1296,"На старте приятная натуралистичная дыня. Потом нота дыни заслащивается и уходит. Остается приятное послевкусие. Стойкость средняя. Летний, поднимающий настроение аромат."
1297,"Wooooow!!! Вкуснейшая на свете дыня на старте, когда немного спадает остается какой то абсолютно потрясающий аромат на коже, который сложно описать, но хочется им поливаться постоянно!!!"
1298,"О, как же это приятно и правдоподобно пахнет медовой нагретой на солнце дыней. Очень реалистичный, совершенно не химозный, сочный, поднимающий настроение аромат. По стойкости ничего не могу сказать, к сожалению перестаю его слышать с себя через пару часов. Но от верхней одежды, если проходишь мимо шкафа чувствуется шлейф. Значит стойкость все таки хорошая."
1299,"Лучшая редкая желанная солнечная сочная дыня! Уважаемый Рандеву очень ждем миниатюры 8мл от вас данного аромата. Пожалуйста, порадуйте своих клиенток!"
1300,"Ох, это прям взрыв сочной медовой дыни прямо с первых нот. Но, единственное, спустя время начал придушивать, заболела голова, захотелось его смыть с запястья. А, так, конечно, очень натуральная дыня"
1301,"Это очень сладкая дыня на миндально ванильной базе. Радует то , что нота дыни держится и не сразу уходит . Стойкость отличная."
1302,"Очень и приочень понравился аромат. Похожих не слышал ни одного. К затесту нужно попробовать обязательно. Не на каждый день, на выход в ресторан или корпоратив."
1303,Это САМЫЙ лучший аромат из всех существующих на сегодняшний день. Нет смысла много о нем писать. Просто попробуйте
1304,"Аромат шикарный, яркий, стойкий, шлейфовый, обволакивающий. Очень красивый и многогранность. Держится очень долго как на коже, так и на одежде"
1305,"Сложно описать словами ольфакторный восторг от этого аромата . Старт окутывает волшебной волной многогранного аромата который переливается апельсинами с деревом усыпанные табаком в перемешку с сухофруктами оттеняется свежестью бергамота,сандала ,жасмина и кедра , то ваниль усыпанная пачули в обрамление ветивера , все это залито великолепным алкоголем . Парфюм переливается ароматами как бриллиант на солнце . Читается уникальный почерк бренда , ещё бы , высокое содержание абсолютов лучшего качества даёт о себе знать . Стойкость запредельная , на коже до 24 часов !!!! На одежде чувствуется даже после стирки , распылил на куртку так после 2 недель был слышен лёгкий флер табака , жасмина ,рома и апельсина . Звучит статусно и заставляет соответствовать . Один из ароматов который останется в памяти навсегда . А кто не попробовал Этот шедевр , пусть исправит это упущение ."
1306,"Великолепный аромат для особых случаев. Аромат постепенно раскрывается и играет разными нотами, фруктов, цитруса, амбры, табака, дерева. Однозначно в коллекцию"
1307,"Blonde Amber это калейдоскоп роскоши. Открывается он взрывом пряного рома и горького апельсина, но этот цитрусовый старт быстро уступает место сердцу. Здесь расцветают тубероза и жасмин, смешиваясь с тягучими сухофруктами и шафраном."
1308,"Роскошный, теплый, стойкий янтарь. Обволакивает шлейфом уюта и изысканности. Духи для особых моментов, оправдывающие свою легендарную репутацию."
1309,"Пахнет дорого, амброй, ванилью, немного древесиной, один из сбалансированных Дух, покупаю 2о раз, говорят их носит президент"
1310,"Ожиданий, конечно, было много, ждала обволакивающий, тяжёлый, согревающий аромат, на деле это самый обычный цитрусовый свежак. Звучит как кислые цитрусы, чуть горьковатые, посыпанные корнем имбиря, потертным на мелкой тёрке, совсем чуть-чуть пробивается ваниль из базы."
1311,"Тягучий, густой аромат. Очень шлейфовый и комплиментарный. Дорогой, унисексовый аромат для особых случаев"
1312,"Мой фаворит, беру уже не первый раз, потрясный аромат, все делают комплименты и достаточно долго держится"
1313,"Из всех относительно новых парфюмерных ароматов - самый запоминающийся. Тёплый, согревающий ром с ванилью. Очень красивый и стойкий."
1314,"Обалденный! Сразу ассоциация с южным итальянским городом, морем, сочным и сладким грейпфрутом! Летом буду носить"
1315,"Сладкий аромат цукатов или каких-то засахаренных апельсинок , красивый, манящий. Отлично подойдет на осень и зиму"
1316,Дольче дольче. Всегда актуально и шикарно. Базовый аромат на любой возраст. Пахнет богатством и роскошью
1317,"Вот и взяла себе полноразмерный флакон devotion. Какой же он ""вкусный"": лимонные пироженки с ванильным кремом. Мужчина мой тоже оценил, хотя он равнодушен к духам, а это показатель!"
1318,"Моя новая парфюмерная любовь. Была уверенна, что не люблю гурманику, а потом попробовала devotion... Горячий лимонный пирог с вензелями взбитых ванильных сливок и посыпкой из цедры. Интенс, который в большинстве хвалят больше, не зашёл - слишком уж сладко. Этот лучше!"
1319,"Сладкий, но не приторный аромат с нотами миндаля и ванили. Звучит дорого и женственно, отлично подходит для прохладного времени года. Стойкость на высоте."
1320,"Аромат - чистый восторг для любителей сладкого! Ощущается как лимонный пирог с ванилью, очень теплый и уютный. Пробника 1,5 мл хватило надолго, так как парфюм довольно стойкий и насыщенный, не на каждый день, буду брать еще"
1321,Интересный и вкусный аромат. Очень напоминает засахаренный мармелад в виде лимонных долек. Стойкий и заметный.
1322,"Сочный бергамот и пряный кардамон встречают прохладой, а благородный табак с замшей и сандалом в базе звучат чувственно и элегантно"
1323,"Вот этот аромат просто пушка. Как девушка так и мужчинам, класс! Что порадовало, так это стойкость, с себя его слышал часов 10-12"
1324,"Это больше в мужскую сторону, брутален, строг в своем звучании, но он бесподобен. Заказала из за табака, чувствую какую-то землистось, чайность, затхлость, скорее всего кожа или даже замшевые ноты, но это так приятно моему носу... На осень очень красиво будет .. нанесла на сгиб и всё подношу к носу и наслаждаюсь"
1325,"Классический мужской аромат с табачными нотами. Долго держится на коже и одежде, шлейф заметный, но не надоедает"
1326,Приятный. Подойдет и мужчинам и женщинам. Оставляет шлейф изысканный. На весну и осень самое то. Спасибо рандеву!
1327,"Очень феминный, Спасибо Рандеву за возможность заказать любимые ароматы в миниатюре! Благодаря вам моя библиотека ароматов постоянно пополняется и это отличная возможность расширять парфгоризонты!"
1328,"В аэропорту Сахалина девушка предложила послушать аромат, так как Creed aventus отсутствовал. Это что-то ребята на стильном!"
1329,"Мягкий, вкрадчивый, обволакивающий, идеально сбалансированный парфюм! Считаю, он унисекс. Без резких нот, прохладный, чуть акватический табак."
1330,Роскошный табачный аромат с пряными и древесными акцентами. Можжевельник и кориандр в сочетании с табаком создают изысканную композицию. База из сандала и мха придает благородство и глубину. Выдающаяся стойкость и проекция. Для истинных ценителей нишевой парфюмерии.
1331,"На сегодняшний день это мой любимый аромат, настолько это великолепный, классный, приятный запах) аромат в котором абсолютно нет ничего что может оттолкнуть. узнал о нём случайно, когда брал духи на распив, продавец положила пробничек) жене тоже понравился, пользуемся вместе. Стойкость бомба, шлейф бомба и что мне еще в нём нравится, я чувствую его на себе."
1332,"Аромат очень красивый! В холодное время года звучит великолепно! Яркий, звонкий, чувствуется фужерность. Красиво обыграны ноты табака и ванили. Превосходная стойкость. Относительно оформления флакона можно петь отдельные оды."
1333,"купила флакон после первого затеста, что делаю редко. было лето и он раскрылся таким бергамотом и медом. мед этот меня покорил. Зимой не так звучит, жду лета)"
1334,"Очень понравился.. Люблю многие пряные ароматы, этот один из любимых. Красиво сочетание меда цитруса и лаванды, их чувствую больше всего из пирамиды"
1335,"Начав с пробника в 1,5, после обзавелся 8 мл и мечтаю офлаконить аромат. Прекрасный, мужской, медово-сладкий и яркий"
1336,"Очень интересный обволакивающий аромат, лимон, корица и мед прям создают вокруг меня невидимую ауру, одназначно привлекает внимание в хорошем смысле. Очень качественное звучание, на протяжении всего дня оседает чуть ближе к коже, но не теряет в своей очаровательности"
1337,"Один из самых любимых ароматов. Очень сладкий, притягательный, комплиментарный. Больше всего чувствую табак и мед. На моей коже до 8 часов спокойно. С одежды не смоется даже после стирки. Аромат не про дорого-богато, скорее про юношескую дерзость и инфантильность, но как же хорош."
1338,"Шикарный пряный аромат с табаком и медом,теплый и уютный.Абсолютный унисекс подходит и мужчинам и женщинам."
